Character;Sentence
hermione;"has anyone seen a toad? | a boy named neville's lost one | oh, are you doing magic? | let's see, then. | are you sure that's a real spell? | well, it's not very good, is it? | of course, i've only tried a few simple ones myself but they've all worked for me. | for example: | oculus reparo. | that's better, isn't it? | holy cricket, you're harry potter! | i'm hermione granger. | and you are...? | pleasure. | you two better change into robes. | i expect we'll be arriving soon. | you've got dirt on your nose, by the way. | did you know? | just there. | it's not real, the ceiling.  | it's just bewitched to look like the night sky. | i read about it in hogwarts: a history. | oh, no. okay, relax. | nearly headless? | how can you be nearly headless? | i've read about those. | when the smoke turns red, it means you've forgotten something. | up. up. up! | harry, no way! | you heard what madam hooch said. | besides, you don't even know how to fly. | what an idiot. | you won't make a fool of yourself.  | it's in your blood. | the staircases change, remember? | we're not supposed to be here.  | this is the 3rd floor.  | it's forbidden. | oh, move over!  | alohomora | get in | standard book of spells, chapter 7. | filch is gone. |  it was locked. |  you don't use your eyes, do you?  | didn't you see what it was standing on? | it was standing on a trap door.  | which means it wasn't there by accident.  | it's guarding something. | that's right.  | now, if you two don't mind, i'm going to bed before either of you come up with another clever idea to get us killed...or worse, expelled! | stop, stop, stop. | you're going to take someone's eye out.  | besides, youre saying it wrong.  | it's leviosa, not leviosar. | wingardium leviosa. | help! help! | ahhh! help! | swish and flick! | is it...dead? | it's my fault, professor mcgonagall.  | i went looking for the troll.  | i'd read about them and thought i could handle it.  | but i was wrong.  | if harry and ron hadn't come and found me... | i'd probably be dead. | ron's right, harry.  | you're gonna need your strength today. | blood? |  but why would anyone go near that dog? | so you're saying... | bit early for mail, isn't it? | it's snape!  | he's jinxing the broom! | leave it to me.  | lacarnum inflamarae. | whoo-hoo! | that thing has a name? | hogwarts teacher or not, i know a curse when i see one.  | i've read all about them.  | you have to keep eye contact.  | and snape wasn't blinking. | i don't know. | that's totally barbaric! | see you haven't. | good. you can help harry, then.  | he's going to go the library for information on nicholas flamel. | not in the restricted section... | happy christmas. | look at you, playing with your cards. | pathetic! | we've got final exams coming up soon. | alright, what are the 3 most crucial ingredients in a forgetfulness potion? | follow me! | i had you looking in the wrong section!  | how could i be so stupid?  | i checked this out a few weeks ago for a bit of light reading. | of course! here it is!  | nicholas flamel is the only known maker of the philosopher's stone! | honestly, don't you two read?  | the philosopher's stone is a legendary substance with astonishing powers.  | it will turn any metal into pure gold and produces the elixir of life, which will make the drinker immortal. | it means you'll never die. | the only stone currently in existence belongs to mr. nicholas flamel, the noted alchemist, who last year celebrated his 665th birthday! | that's what fluffy's guarding on the 3rd floor.  | that's what's under the trapdoor... | the philosopher's stone! | of course! there are other things defending the stone, aren't there? | spells and enchantments. | is that...a dragon? | is that bad? | well, that's good, isn't it?  | he'll be with his own kind. | harry! | you mean, you-know-who's out there, right now, in the forest? | hang on a minute. | we're forgetting one thing.  | who's the one wizard voldemort always feared? |  dumbledore!  | as long as dumbledore's around, you're safe.  | as long as dumbledore's around, you can't be touched.  |  i've always heard hogwarts' end of the year exams were frightful, but i found that rather enjoyable. | it's happened before. |  what is it? |  and with dumbledore gone | uh...we were just... | now what do we do? |  neville, i'm really, really sorry about this |  petrificus totalus. | sorry. | ow! you stood on my foot! | alohomora. | the harp. it stopped playing. | stop moving, both of you.  | this is devil's snare.  | you have to relax.  | if you don't, it will only kill you faster. | just relax! | do what i say. trust me.  | are you okay? | he's not relaxing, is he? | we've got to do something! | uh! i remember reading something in herbology.  | um devil's snare, devil's scare,it's deadly fun...but will sulk in the sun!  | that's it! devil's snare hates sunlight! | lumus solem! | what is that? | curious. i've never seen birds like these. | what's this all about? | ugh! what're we going to do?  | there must be 1000 keys up there! | what's wrong, harry? | i don't like this.  | i don't like this at all. | now what do we do? | what happens now? | ron, you don't suppose this is going to be like...real wizard's chess, do you? |  what is it? | no, ron, you can't! | there must be another way! | you'll be okay, harry.  | you're a great wizard, you really are. | me? books and cleverness?  | there are more important things.  | friendship, and bravery.  | and harry, just be careful. | never better. | we're tied with slytherin! | come on, harry. | feels strange to be going home, doesn't it? | harry. hagrid. | it's so good to see you. | what did you do to your glasses? | oculus reparo. | okay, bye. | come on, everyone's been so worried. | fear of a name only increases fear of the thing itself. | mandrake, or mandragora is used to return those who have been petrified to their original state. | it's also quite dangerous.  | the mandrake's cry is fatal to anyone who hears it. | get off me! | immobulus! | at least no one on the gryffindor team had to buy their way in. | they got in on pure talent. | you okay, ron? | say something. | he called me a mudblood. | it means ""dirty blood. | mudblood's a foul name for someone who's muggle-born. | someone with non-magic parents. | someone like me. | it's not a term one usually hears in civilized conversation. | harry! | voice? what voice? | harry, wait! not so fast! | the chamber of secrets has been opened. 
enemies of the heir, beware. | enemies of the heir, beware. | it's written in blood. | that's why ron and i went looking for him, professor. | we'd just found him when he said... | it's a bit strange, isn't it? | you hear this voice, a voice only you can hear... | and then mrs. norris turns up petrified. it's just strange. | no, harry. even in the wizarding world, hearing voices isn't a good sign. | professor i was wondering if you could tell us about the chamber of secrets. | muggle-borns. | professor? what exactly does legend tell us lies within the chamber? | yes. couldn't you tell?  | mcgonagall's worried.  | all the teachers are. | the heir of slytherin has returned to hogwarts.  | the question is, who is it? | if you're talking about malfoy... | i heard him. | but malfoy, the heir of slytherin? | even they aren't that thick. | but there might be another way. | mind you, it would be difficult. | not to mention we'd be breaking about 50 school rules... | and it'll be dangerous. | very dangerous. | here it is. | the polyjuice potion. | properly brewed, the polyjuice potion allows the drinker to transform himself temporarily into the physical form of another. | yes  | exactly. | but it's tricky.  | i've never seen a more complicated potion. | a month. | i know. | but it's the only plan we've got. | no! even with a proper wand, it's too risky. | you could hit harry. | let's go. | finite incantatem! | are you okay? | you will be able to, won't you? | again? you mean the chamber of secrets has been opened before? | maybe. | we'll have to wait for the polyjuice potion to know for sure. | no. no one ever comes in here. | moaning myrtle. | moaning myrtle. | she's a little sensitive. | do you think he's all right? | you can talk to snakes. | no, they can't. | it's not a very common gift, harry. | this is bad. | i don't know, but it sounded like you were egging the snake on or something. | harry, listen to me. | there's a reason the symbol of slytherin house is a serpent. | salazar slytherin was a parselmouth. | he could talk to snakes too. | he lived a thousand years ago. | for all we know, you could be. | everything's set.  | we just need a bit of who you're changing into. | we also need to make sure that the real crabbe and goyle can't burst in on us while we're interrogating malfoy. | i've got it all worked out. | i filled these with a simple sleeping draught. | simple, but powerful. | now, once they're asleep hide them in the broomstick cupboard and pull out a few of their hairs and put on their uniforms. | i've already got mine. | millicent bulstrode. slytherin. | i got this off her robes. | i'm going to go check on the polyjuice potion. | make sure that crabbe and goyle find these. | we'll have exactly one hour before we change back into ourselves. | add the hairs. | cheers. | me too. | i...i don't think i'm going. | you go on without me. | just go. you're wasting time. | go away. | do you remember me telling you that the polyjuice potion was only for human transformations? | it was cat hair i plucked off millicent bulstrode's robes. | look at my face. | it can't be hagrid. | it just can't be. | look, hagrid's our friend.  | why don't we just go and ask him about it? | it had to be a gryffindor. | nobody else knows our password. | unless it wasn't a student. | thanks, sir nicholas. | it's good to be back. | congratulations. | i can't believe you solved it. | thanks. | oh, no. | it's a cat, ronald. | what do you expect? | it's in his nature. | that's rich coming from the owner of that smelly old shoe brush. | crookshanks, just ignore the mean little boy. | harry. | egyptians used to worship cats. | good morning, mr. weasley. | honestly, ron, it's not funny. | harry was lucky not to be expelled. | come on. everywhere else is full | professor r.j. lupin. | it's on his suitcase, ronald. | seems to be. why? | but they'll catch black, won't they? | i mean, everyone's looking for him. | why are we stopping? | we can't be there yet. | ouch, ron. that was my foot. | harry. | harry, are you all right? | no one was screaming, harry. | of course. that's why he knew to give you the chocolate, harry. | just forget it. | that's awful. | what a load of rubbish. | me? | i've been here all this time. | oh, honestly, ron. if you ask me, divination's a woolly discipline. | now, ancient runes, that's a fascinating subject. | a fair few. | don't be silly. how could anyone be in two classes at once? | broaden your minds. use your inner eye to see the future. | i think they're funny. | just ignore him. | tah- tah- tah- dah! isn't he beautiful? | say hello to buckbeak. | that was wicked, harry! | hagrid! he has to be taken to the hospital. | i hear draco's father's furious. | we haven't heard the end of this. | dufftown? that's not far from here. | no one knows. | boggarts are shape-shifters. | they take the shape of whatever a person fears the most. | that's what makes them so... | it's not funny, ron. | sir, we just learned about red caps and hinkypunks. | we're not meant to start that for weeks. | please, sir. | an animagus is a wizard who elects to turn into an animal. | a werewolf has no choice. | with each full moon he no longer remembers who he is. | he'd kill his best friend. | furthermore, the werewolf only responds to the call of its own kind. | go, harry! go, harry! | how are you feeling? | no one blames you, harry. | dementors aren't supposed to be on the grounds. dumbledore's furious. | after he saved you, he sent them off. | it's meant to be the most haunted building in britain. did i mention that? | do you want to move a bit closer? | to the shrieking shack? | hope you don't mean yourself. | harry! | he won't keep it. he'll turn it over to professor mcgonagall. aren't you? | look who it is. madam rosmerta. | ron fancies her. | harry! | so rude. | ron, look! | sorry. sorry. excuse me, excuse me. | harry, what happened? | beautiful day. | ronald has lost his rat. | rubbish. | well, maybe you should learn to take better care of your pets! | did not. | didn't. | how did it go, hagrid? the hearing? | and then? | do you mind me trying? | the grim, possibly. | i can't believe they're going to kill buckbeak. it's just too horrible. | you! you foul, loathsome, evil little cockroach! | that felt good. | we'll stay with you too. | i think you owe someone an apology. | i meant me! | i thought i just saw...never mind. | ron. ron! | harry, you do realize what tree this is? | ron!! | ron! | duck! | harry! | oh, i'm sorry. | where do you suppose this goes? | we're in the shrieking shack, aren't we? | ron. you're okay. | if you want to kill harry, you have to kill us too! | no! i trusted you! | and all this time, you've been his friend. | he's a werewolf! | that's why he's been missing classes. | since professor snape set the essay. | you attacked a teacher! | you go, i'll stay. | that looks really painful. | i'm sure madam pomfrey will fix it in a heartbeat. | harry! | harry! | wait. wait. | professor? professor lupin? | harry? | what? | listen harry, they've captured sirius. | any minute the dementors are gonna perform the kiss. | no. it's worse. | much worse. | they're going to suck out his soul. | headmaster, you've got to stop them. | they've got the wrong man. | the point is, we know the truth. | please believe us. | sorry, ron, but seeing as you can't walk... | 07:30. where were we at 7:30? | come on. and we can't be seen. | you! you foul, loathsome,evil little cockroach! | this is a time-turner, harry. | mcgonagall gave it to me first term. | this is how i've been getting to my lessons all year. | yes. | dumbledore obviously wanted us to return to this moment. | clearly, something happened he wants us to change. | thanks. | malfoy's coming. | that felt good. | of course. | remember what dumbledore said? | if we succeed, more than one innocent life could be spared. | let's go. | fudge has to see buckbeak before we steal him. | otherwise, he'll think hagrid set him free. | harry, you can't. | yes, and you must! | harry, you're in hagrid's hut now. | if you go bursting in, you'll think you've gone mad. | awful things happen to wizards who meddle with time harry. | we can't be seen. | fudge is coming. | and we aren't leaving? | why aren't we leaving? | sorry. | we're coming out the back door. go! | is that really what my hair looks like from the back? | i thought i just saw… never mind. | okay, go, harry. go! | keep trying. come on. quickly. | come on. come on, buckbeak. | come and get the nice dead ferret. | come on. it's here. come on, beaky. | come on, buckbeak. come on. | buckbeak. | come on. | we save sirius. | no idea. | look. it's lupin. | and snape's coming. | and now we wait. | at least someone's enjoying himself. | yeah? | with a patronus. | i heard snape telling dumbledore. | according to him only a really powerful wizard could have conjured it. | harry, but your dad's... | here we come. | that's great. | harry! | saving your life. | yeah, i didn't think about that. run! | that was so scary. | this is horrible. | harry, listen to me. | no one's coming. | you're dying both of you. | harry! | no. but i don't like flying...! | bombarda! | we have to go. | what's he talking about, harry? | this came with it. | how fast is it, harry?"
neville;trevor! sorry. | that picture's moving. | the only problem is, i can't remember what i've forgotten. | down, down! | parvati patil said that she wouldn't come out of the girl's bathroom.  | she said that she'd been in there all afternoon...crying. | how? i can barely stand at all! | no, that's all i need! | you to set my bloody kneecups on fire! | hey! wait! where are you going? | what about the countercurse? | neither should you.  | you're sneaking out again, arent you? | no! i won't let you! |  you'll get gryffindor in trouble again! |  i-i'll fight you. | go on, ron.  | i ignored one from my gran once.  | it was horrible. | please, get me down! | why is it always me? | harry, i don't know who did it, but you'd better come. | come on! | harry. it's hermione. | i think so. | i'm okay. okay. | yeah. | you don't think he'd come to hogwarts, do you? | professor snape. | professor snape. | yes. i don't want it to turn into her, either. | she carries a red handbag... | riddikulus! | hey. | harry. | wherever did you get it?
malfoy;"it's true then, what they're saying on the train. | harry potter has come to hogwarts. | this is crabbe, and goyle. | and i'm malfoy. | draco malfoy. | think my name's funny, do you? | i've no need to ask yours. | red hair and a hand-me-down robe? | you must be a weasley. | we'll soon find out that some wizarding families are better than others, potter. | you don't want to go making friends with the wrong sort. | i can help you there. | up. | did you see his face? | maybe if the fat lump had given this a squeeze, he'd have remembered to fall on his fat arse. | no. i think i'll leave it somewhere for longbottom to find. | how about on the roof? | what's the matter, potter? | bit beyond your reach? | is that so? | have it your way, then. | excuse me, professor.  | perhaps i heard you wrong.  | i thought you said...""the four of us."" | the forest? i thought that was a joke!  | we can't go in there.  | students aren't allowed. |  and there are...werewolves! | okay. then i get fang! | you wait till my father hears about this.  | this is servant's stuff. | scared, potter?!  | did you hear that?  | come on, fang.  scared. | ahhhhhhhhh!!! ahhh! help!!!!! | nice one, mate! "
whispers;harry potter?
sorting hat;ah, right then... hmm... right. | okay. gryffindor! | slytherin! | let's see i know! hufflepuff! | another weasley! | i know just what to do with you. | gryffindor! | hmm... difficult, very difficult. | plenty of courage, i see. | not a bad mind, either. | there's talent, oh, yes. | and a thirst to prove yourself. | but where to put you? | not slytherin, eh? are you sure? | you could be great, you know. | it's all here, in your head. | and slytherin will help you on the way to greatnesses, no doubt about that. | no? well, if you're sure. | better be...gryffindor! | bee in your bonnet, potter? | yes. you were particularly difficult to place. | but i stand by what i said last year. | you would have done well in slytherin.
seamus;i'm half and half. | my dad's a muggle. mum's a witch. | bit of a nasty shock for him when he found out. | eye of rabbit, harp string hum | turn this water into rum. | eye of rabbit... | wingard levosa. wingardly lev...  | i'll do the countercurse! | i don't appreciate the insinuation, longbottom. | besides, if anyone cared to notice my eyebrows have completely grown back! | yeah! we won!! | no, ma'am, he's just fainted. | heads up, everyone.  | weasley's gotten himself a howler. | cornish pixies? | fortuna major. | here, listen. | she just won't let me in. | exactly. | hey, man. | ron, catch. | i think we have a winner. | oh, no. | the grin? what's the grin? | he's been sighted! | sirius black! | dementors? | he slipped past them once. | who's to say he won't do it again? | can i have a go, harry? | after you, of course.
percy;oh, thats professor snape, head of slytherin house. | potions. | but everyone knows, its the dark arts he fancies. | he's been after quirrell's job for years. | hello, sir nicholas. | have a nice summer? | gryffindors, follow me please. | keep up. thank you. | this is the most direct path to the dormitories. | oh, and keep an eye on the staircases. | they like to change. | keep up, please, and follow me. | quickly now, come on. come on. | caput draconis. | follow me, everyone. keep up. | quickly, come on. | gather around here. | welcome to the gryffindor common room. | boys' dormitory is upstairs and down to your left. | girls, the same on your right. | you'll find that your belongings have already been brought up. | gryffindors...keep up please.  | and stay alert! | errol... | oh look, it’s our hogwarts letters.  | and they’ve sent us harry’s as well. | hello, sir nicolas. | excuse me. | i happen to be a school prefect. | you, on the other hand, have no business wandering the corridors at night. | what are your names again? | mind your attitude, malfoy. | let me through, please. | excuse me! i'm head boy! | get back, all of you. | no one is to enter this dormitory until it's been searched. | keep calm, everyone. break into fours. | back to your common room. | be quiet. make way. | the headmaster's here. | you heard. move! | mind where you're going! slow down! | you listen! i'm head boy! | come back here!
sir nicholas;hello! how are you? | welcome to gryffindor. | dismal. once again, my request to join the headless hunt has been denied. | i prefer sir nicholas, if you don't mind. | like this. | have you heard?  | harry potter's the new gryffindor seeker.  | i always knew hed do well. | hello, percy, miss clearwater. | thank you. | good evening. | thank you. | hello. | hermione! welcome back.
girl;look, it's the bloody baron! | oh, look! look! | who's that girl? | is he all right? | hufflepuff, this way!
man in paint;welcome to hogwarts.
fat lady;password? | no, no. wait, wait. | watch this. | amazing. just with my voice. | yes, all right. go in. | eyes like the devil, he's got, and a soul as dark as his name. | it's him, headmaster. | the one they all talk about. | he's here, somewhere in the castle! | sirius black!
