Character;Sentence
snape;"there will be no foolish wand-waving or silly incantations in this class. | as such, i don't expect many of you to appreciate the subtle science and exact art that is potion-making. | however, for those select few who possess the predisposition i can teach you how to bewitch the mind and ensnare the senses. | i can tell you how to bottle fame brew glory and even put a stopper in death. | then again, maybe some of you have come to hogwarts in possession of abilities so formidable that you feel confident enough to not pay attention. | mr. potter. | our new celebrity. | tell me, what would i get if i added powdered root of asphodel to an infusion of wormwood? | you don't know? well, let's try again. | where, mr potter, would you look if i asked you to find me a bezoar? | and what is the difference between monkshood and wolfsbane? | pity. | clearly, fame isn't everything is it, mr. potter? | silence. | put your hand down, you silly girl! | for your information, potter | asphodel and wormwood make a sleeping potion so powerful it is known as the draught of the living dead. | a bezoar is a stone taken from the stomach of a goat and it will save you from most poisons. | as for monkshood and wolfsbane, they are the same plant, which also goes by the name of aconite. | well... | why aren't you all copying this down? | and gryffindors note that five points will be taken from your house for your classmate's cheek. | good luck today, potter.  | then again, now that you've proven yourself against a troll, a little game of quidditch should be easy work for you...even if it is against slytherin. | what? oh! | you don't want me as your enemy, quirrell. | you know perfectly well what i mean.  | we'll have another chat soon... | when you've had time to decide where your loyalties lie. |  good afternoon.  | now, what would three young gryffindors such as yourselves be doing inside on a day like this? | you want to be careful. | people will think you're up to something. | you were seen by no less than seven muggles. | do you have any idea how serious this is? | you have risked the exposure of our world. | not to mention the damage you inflicted on a whomping willow. | that's been on these grounds since before you were born. | silence. | i assure you that were you in slytherin, and your fate rested with me...  | the both of you would be on the train home tonight. | as it is... | headmaster these boys have flouted the decree for the restriction of underage wizardry. | if i might, headmaster? | perhaps potter and his friends were just in the wrong place at the wrong time. | however the circumstances are suspicious. | i, for one, don't recall seeing potter at dinner. | yes, miss granger? | expelliarmus! | perhaps it would be prudent to first teach the students to block unfriendly spells, professor. | weasley's wand causes devastation with the simplest spells. | we'll be sending potter to the hospital wing in a matchbox. | might i suggest someone from my own house? | malfoy, perhaps? | don't move, potter. | i'll get rid of it for you. | vipera evanesca. | a girl has been snatched by the monster, lockhart.  | your moment has come at last. | weren't you saying just last night that you've known all along where the entrance to the chamber of secrets is? | i've done the dungeons. | no sign of black, nor anywhere else in the castle. | remarkable feat, don't you think? | to enter hogwarts castle on one's own completely undetected? | any theories on how he managed it? | you may recall prior to the start of term i expressed concerns about your appointment of professor... | what about potter? | should he be warned? | turn to page 394. | that's not really your concern, is it, potter? | suffice it to say your professor finds himself incapable of teaching at the present time. | turn to page 394. | quiet. | now, which one of you can tell me the difference between an animagus and a werewolf? | no one? | how disappointing. | thank you, mr. malfoy. | that's the second time you've spoken out of turn, miss granger. | are you incapable of restraining yourself or do you take pride in being an insufferable know-it-all? | five points from gryffindor. | as an antidote to your ignorance, and on my desk, by monday morning two rolls of parchment on the werewolf, with emphasis on recognizing it. | then i suggest you take extra care, mr. potter. | loss of limb will not excuse you. | page 394. | the term ""werewolf"" is a contraction of the anglo-saxon word ""were"" which means ""man,"" and ""wolf."" werewolf, man-wolf. | there are several ways to become a werewolf. | they include being given the power of shape-shifting being bitten by a werewolf... | potter. | what are you doing wandering the corridors at night? | how extraordinarily like your father you are, potter. | he, too, was exceedingly arrogant, strutting about the castle. | turn out your pockets. | turn out your pockets! | what's this? | really? open it. | reveal your secrets. | read it. | go on. | you insolent little... | well, well. lupin. | out for a little walk in the moonlight, are we? | that remains to be seen. | i have now just confiscated a rather curious artifact. | take a look, lupin. | supposed to be your area of expertise. | clearly, it's full of dark magic. | expelliarmus! | vengeance is sweet. | how i hoped i'd be the one to catch you. | i told dumbledore you were helping a friend into the castle. here's the proof. | give me a reason. i beg you! | you two, quarrelling like an old married couple. | i could do it, you know. | but why deny the dementors? | they're so longing to see you. | do i detect a flicker of fear? | oh, yes. a dementor's kiss. one can only imagine what that must be like. | it's said to be nearly unbearable to witness, but i'll do my best. | after you. | there you are, potter! | come back here, potter!"
dean;hey, look! neville's got a remembrall | ron, is that your owl? | oh, god. | you call that a monkey? | that's a boggart, that is.
madam hooch;"good afternoon, class. | good afternoon, amanda. | good afternoon. | welcome to your first flying lesson. | well, what are you waiting for?  | everyone step up to the left side of their broomstick. | come on now, hurry up.  | stick your right hand over the broom and say, ""up."" | with feeling. | now, once you've got hold of your broom, i want you to mount it. | and grip it tight, you don't wanna be sliding off the end. | when i blow my whistle, i want each of you to kick off from the ground, hard. | keep your broom steady, hover for a moment | then lean forward slightly and touch back down. | on my whistle. three, two... | mr. longbottom. | mr. longbottom! | come back down this instant! | everyone out of the way! | oh, dear, it's a broken wrist. | poor boy. come on now, up you get. | everyone's to keep their feet firmly on the ground while i take mr longbottom to the hospital wing. | understand? if i see a single broom in the air the one riding it will find themselves out of hogwarts before they can say, quidditch. | now, i want a nice clean game...from all of you.  | gryffindor win!"
class;good afternoon, madam hooch. | up! | neville! | the swish and flick.  | good morning, everyone. | riddikulus! | riddikulus!
filch;anyone here, my sweet? come on. | who's there?!  | i know you're in there.  | you can't hide.  | who is it?  | show yourself! | oh, professors. i found this, in the restricted section.  | it's still hot.  | that means there's a student out of bed. | a pity they let the old punishments die.  | there was a time detention would find you hanging by your thumbs in the dungeons.  | god, i miss the screaming.  | you'll be serving detention with hagrid tonight. | he's got a little job to do inside the dark forest. | a sorry lot this, hagrid.  | oh, good god, man, you're not still on about that bloody dragon, are you? | oh, for gods sake, pull yourself together, man.  | you're going into the forest, after all.  | got to have your wits about you. |  there's more than werewolves in those trees, lad.  | you can be sure of that. | nighty-night. | well, take a good look, lads. | this night might well be the last you spend in this castle. | oh, dear, we are in trouble. | as such... | what's going on here? | go on. make way, make way. | potter? | what are you...? | mrs. norris? | you've murdered my cat. | i'll kill you. | i'll kill you! | ask him. | it's him that's done it. | you saw what he wrote on the wall. | rubbish. | my cat has been petrified. | i want to see some punishment! | caught in the act. | i'll have you out this time, potter. | mark my words. | those with permission, follow me. | those without, stay put. | come on, move. | there's no need for ghosts, professor. | the fat lady's there. | i've searched the astronomy tower and the owlery.  | there's nothing there.
all;ahhhhhhh!  | yay!
oliver;quidditch is easy enough to understand.  | each time has seven players, 3 chasers, 2 beaters, 1 keeper and a seeker that's you.  | there are three kinds of balls.  | this one's called the quaffle. | now, the chasers handle the quaffle and try to put it through one of those three hoops.  | the keeper, that's me, defends the hoops.  | with me so far? | you better take this.  | careful now, it's comin' back.  | eh, not bad, potter, you'd make a fair beater...uh-oh.  | bludger. nasty little buggers.  | but you are a seeker. | the only ball i want you to worry about is this...the golden snitch.  | ah, you like it now.  | just wait.  | it's wicked fast and damn near impossible to see. | you catch it...before the other team's seeker.  | you catch this, the game is over.  | you catch this, potter, and we win. | that's all right.  | i felt the same way before my first game. | er, i don't really remember.  | i took a bludger to the head 2 minutes in.  | woke up in the hospital a week later.
flitwick;one of a wizard's most rudimentary skills is levitation the ability to make objects fly.  | uh, do you all have your feathers? good.  | now, uh, don't forget the nice wrist movement we've been practicing, hmm?  | the swish and flick. everyone.  | good.  | and enunciate.  | wingardium leviosa.  | off you go then. | oh, well done!  | see here, everyone!  | ms. granger's done it!  | oh, splendid! | whooaaa! ooh.
draco;wingardium levio-saaa. | no! | can i have this? |  it's not my fault the teachers have favorites.  | that hermione granger -- | i'll bet you loved that, didn't you, potter? | famous harry potter. | can't go into a bookshop without making the front page. | look, potter. | you've got yourself a girlfriend. | see you at school. | that's right. | and that's not all that's new this year. | you see, weasley, unlike some, my father can afford the best. | no one asked your opinion, you filthy little mudblood. | enemies of the heir, beware. | you'll be next, mudbloods. | all right there, scarhead? | training for the ballet, potter!! | you'll never catch me, potter. | scared, potter? | everte statum! | serpensortia! | crabbe, goyle, where have you been? | pigging out in the great hall all this time? | why are you wearing glasses? | reading? | i didn't know you could read. | and what are you doing down here, weasley? | well, sit down. | you'd never know the weasleys were pure-bloods, the way they behave. | they're an embarrassment to the wizarding world. all of them. | what's wrong with you, crabbe? | i'm surprised the daily prophet hasn't done a report on all these attacks. | i suppose dumbledore is trying to hush it all up. | father always said dumbledore was the worst thing that ever happened to this place. | what? | you think there's someone here who's worse than dumbledore? | well? do you? | good one, goyle. | you're absolutely right. | saint potter. | and people actually think that he's the heir of slytherin? | you know i don't, goyle. | i told you yesterday. | how many times do i have to tell you? | is this yours? | but my father did say this: | it's been 50 years since the chamber was opened. | he wouldn't tell me who opened it. | only that they were expelled. | the last time the chamber of secrets was opened, a mudblood died. | so it's only a matter of time before one of them is killed this time. | as for me i hope it's granger. | what's the matter with you two? | you're acting very odd. | hey! where are you going? | potter. is it true you fainted? | i mean, you actually fainted? | exactly how do we do that? | don't be such a wimp, longbottom. | oh, yeah. terribly funny. | witty. god, this place has gone to the dogs. | wait until father hears dumbledore's got this oaf teaching classes. | dementor! dementor! | oh, please. | you're not dangerous at all, are you, you great ugly brute! | it's killed me! | you're gonna regret this. | you and your bloody chicken! | it comes and it goes. | still, i consider myself lucky. | madam pomfrey said another minute and i could've lost my arm. | i can't do homework for weeks. | this class is ridiculous. | well, well. look who's here. | you two shopping for your new dream home? | bit grand for you, isn't it, weasle-bee? | don't your family sleep in one room? | not very friendly. | boys, i think it's time we teach weasle-bee how to respect his superiors. | how dare you talk to me! | you filthy little mudblood! | who is that? | don't stand there! do something! | get out of the way! | move! | what did i say? father said i can keep the hippogriff's head. | i'll donate it to the gryffindors' room. | this is going to be rich. | come to see the show? | not a word to anyone, understood? | come to see the show? | not a word to anyone, understood? | i'm gonna get that jumped-up mudblood! mark my words.
ron and harry;well, what it is... | the what? |   hermione!!
oiiver;scared, harry?
lee jordan;hello, and welcome to hogwarts' first quidditch game of the season!  | today's game slytherin versus gryffindor!!! | the players take their positions as madam hooch steps out onto the field to begin the game. | the bludgers are up...followed by the golden snitch.  | remember, the snitch is worth 150 points.  | the seeker who catches the snitch ends the game. | the quaffle is released...and the game begins! | angelina johnson scores!  | 10 points for gryffindor!  | slytherin takes possession of the quaffle. | bletchley passes to captain marcus flint. |  another 10 points to gryffindor!  | another goal for slytherin! | they lead gryffindor 90 to 30. | harry potter has caught the snitch. | gryffindor wins!
gryffindors;yay!
flint;give me that!  | take that side! | quidditch practice. | easy, wood. i've got a note. | a gift from draco's father.
crowd;boooo!! | go go gryffindor! go go gryffindor!  | go go gryffindor!!
lee  jordan;he's got the snitch!  | harry potter receives 150 points for catching the snitch!
hermoine;and what, may i ask, do you plan to do if this comes up in the final exam? | no, you won't. | besides, according to professor mcgonagall, we're to be given special quills bewitched with an anti cheating spell.
all 3;we know about the sorcerer's stone!
firenze;harry potter, you must leave.  | you are known to many creatures here.  | the forest is not safe at this time.  | especially for you. | a monstrous creature.  | it is a terrible crime to slay a unicorn.  | drinking the blood of a unicorn will keep you alive even if you are an inch from death.  | but at a terrible price.  | you have slain something so pure that the moment the blood touches your lips, you will have a half-life.  | a cursed life. | can you think of no one? | do you know what is hidden in the school at this very moment? | harry potter, this is where i leave you.  | you're safe now. good luck.
voldemort;use the boy | he lies. | let me speak to him. | i have strength enough for this.  | harry potter. we meet again. | yes. you see what i have become?  | see what i must do to survive?  | live off another. a mere parasite.  | unicorn blood can sustain me, but it cannot give me a body of my own.  | but there is something that can.  | something, that conveniently enough, lies in your pocket! | stop him!  | don't be a fool!  | why suffer a horrific death when you can join me and live?! | haha. bravery. your parents had it too.  | tell me, harry, would you like to see your mother and father again?  | together, we can bring them back.  | all i ask for is something in return.  | that's it, harry.  | there is no good and evil.  | there is only power, and those too weak to seek it.  | together, we'll do extraordinary things.  | just give me the stone!  | kill him! | fool! get the stone! | arrrhhhhhh!
students;whoo! yeah!
uncle vernon;i’m warning you, if you can’t control that bloody bird it’ll have to go. | i should think you’d be a little more grateful.  | we’ve raised you since you were a baby, given you the food off our table, even let you have dudley’s second bedroom, purely out of the goodness of our hearts. | which should be any minute!  | ahem...now let’s go over our schedule once again, shall we?  | petunia when the masons arrive you will be...? | good! and- and dudley, you will be...? | excellent! ...and you...? | too right, you will.  | with any luck, this could well be the day i make the biggest deal of my career.  | and you will not mess it up! | mr. and mrs. mason! do come in! | ohh, don’t mind that!  | it’s just the cat. | what the devil are you doing up here? | you just ruined the punch line of my japanese golfer joke! | one more sound, and you’ll wish you’d never been born, boy!  | and fix that door! | ...it spread as far as the eye could see, all over the floor of this vast building, and it was this deep.  | and one plumber said “look at all that water.”  | a-and the second plumber said, “yes, and that’s just the top of it!” | i’m so sorry! it’s my nephew- he’s very disturbed.  | meeting strangers upsets him.  | that’s why i kept him upstairs! | you’re never going back to that school.  | you’re never going to see those freaky friends of yours again. never! | now, what the hell’s he doing? potter! | petunia, he’s escaping! | come here! | oh no, boy! you and that bloody pigeon aren’t going anywhere! | no! no! no! no! aaaah! | oh... damn. | what is it? | later perhaps. if you behave. | take marge's suitcase upstairs. | can i tempt you, marge? | st. brutus'. it's a fine institution for hopeless cases. | i think it's time you went to bed. | stop! | i've got you, marge. i've got you. | hold on, hold on. | get off. | sorry. | oh, god. marge! | please! marge! come back! | you bring her back! | you bring her back now. | you put her right! | you can't do magic outside school. | they won't let you back now. | you've nowhere to go.
aunt petunia;not now, pupkins. for when the masons arrive. | in the lounge, waiting to welcome them graciously into our home. | oh! | harry! harry! | harry!! open the door. | marge! how lovely to see… | nothing. he didn't work. | he was unemployed. | oh, vernon.
dobby;ha- ha- ha! ha, ha! ho, ho, ho! ha, ha!  | harry potter! such an honor it is! | dobby sir, dobby the house elf. | oh, oh yes, sir! dobby understands!  | it’s just that, dobby has come to tell you- it is difficult, sir |  dobby wonders where to begin? | s-sit down? s-sit- sit down?  | oh, oh, ho. oh, ho, ho... oh, ho, ho. | offend dobby?  | dobby has heard of your greatness, sir, but never has he been asked to sit down by a wizard, like an equal. | no, i haven’t.  | that was an awful thing to say.  | bad dobby! | bad dobby! | baaad dobby! | bad dobby.  | bad dobby! | dobby had to punish himself, sir.  | dobby almost spoke ill of his family, sir. | the wizard family dobby serves, sir.  | dobby is bound to serve one family forever.  | if they ever knew dobby was here...ooh...  | but dobby had to come.  | dobby has to protect harry potter- to warn him.  | harry potter must not go back to hogwarts school of witchcraft and wizardry this year!  | there is a plot, a plot to make most terrible things happen. | ooo... er... can’t... say... argh... | don’t make me talk, i— errr... | bad dobby. | let me go! | friends who don’t even write to harry potter? | harry potter mustn’t be angry with dobby.  | heh- dobby hoped, if harry potter thought his friends had forgotten him, harry potter might not want to go back to school, sir. | no! ahh! ooh... | harry potter must say he’s not going back to school! | then, dobby must do it, sir, for harry potter’s own good.  | hello. | harry potter should have listened to dobby. | harry potter should have gone back home when he missed the train. | indeed. yes, sir. | at least you would be away from here. | harry potter must go home. | dobby thought his bludger would be enough to make harry potter see... | dobby feels most aggrieved, sir. | dobby had to iron his hands. | dobby is used to death threats, sir. | dobby gets them five times a day at home. | not kill you, sir. | never kill you. | dobby remembers how it was before harry potter triumphed over he-who-must-not-be-named. | we house-elves were treated like vermin, sir. | of course, dobby is still treated like vermin. | this, sir? it is a mark of the house-elf's enslavement. | dobby can only be freed if his master presents him with clothes. | listen. | listen! | terrible things are about to happen at hogwarts. | harry potter must not stay here...now that history is to repeat itself. | oahh! i shouldn't have said that. | bad dobby! bad! | dobby cannot say, sir.  | dobby only wants harry potter to be safe. | master has given dobby a sock. | master has presented dobby with clothes. | dobby is free. | you shall not harm harry potter. | harry potter freed dobby. | how can dobby ever repay him? | anything, sir.
aunt petunia & dudley;aaah!
mr. weasley;morning, weasleys. | what a night. nine raids. nine! | well now. aah! and who are you? | good lord! are you really?  | well, ron’s told us all about you, of course. | when did he get here? | did you really? how’d it go? did you— | i mean...that was very wrong, indeed, boys.  | very wrong of you | now, harry, you must know all about muggles.  | tell me, what exactly is the function of a rubber duck? | dumbledore must know you’re here, harry.  | doesn’t miss a trick, that man. | diagonally. | children, it's mad in here. | let's go outside. | lucius. | we have a very different idea about what disgraces the name of wizard, malfoy. | 10:58, come on. | fred, george, percy, you first. | after you, dear. | harry potter. | harry, wonder if i might have a word? | hermione. | looking forward to a new term? | harry, some within the ministry would strongly discourage me from divulging what i'm about to reveal to you. | but i think that you need to know the facts. | you are in danger. | grave danger. | what do you know about sirius black, harry? | do you know why? | thirteen years ago, when you stopped... | don't say his name. | when you stopped you-know-who black lost everything. | but to this day, he still remains a faithful servant. | and in his mind you are the only thing that stands in the way of you-know-who returning to power. | and that is why he has escaped from azkaban. | to find you. | harry, swear to me that whatever you might hear you won't go looking for black.
fred, george, ron;morning, dad.
fred, george, ron, harry;oh, it...
mr. borgin;mr. malfoy! what a pleasure to see you again.  | if i may, just in today -- |  selling? | hmmm... yes. i see... | ah, the hand of glory.  | insert a candle and it gives light only to the holder.  | best friend of thieves and plunderers.  | your son has fine taste, sir. | it's the same all over.  | wizard blood is counting for less everywhere.
