Character;Sentence
harry;"yes, aunt petunia. | yes, uncle vernon. | he's asleep! | sorry about him. | he doesn't understand what it's like, lying there day after day... | ...watching people press their ugly faces in on you. | can you hear me? | it's just, i've never talked to a snake before. | do you...? | i mean, do you talk to people often? | you're from burma, aren't you? | was it nice there? | do you miss your family? | i see. that's me as well. | i never knew my parents either. | mummy, dad, come here!  | anytime. | i swear, i don't know! | one minute the glass was there and then it was gone, it was like magic. | will i have to wear that too? | that's dudley's old uniform. | it'll fit me like bits of old elephant skin. | hey, give it back! it's mine! | because there's no post on sundays? | get off! | they're my letters! | let go of me! | make a wish, harry. | i am. | thank you. | excuse me, who are you? | sorry, no. | learnt what? | i'm a what? | no, you've made a mistake. | i mean...l can't be a wizard. | i mean, i'm just harry. | just harry. | dear mr. potter, | we are pleased to inform you that you have been accepted at hogwarts school of witchcraft and wizardry."" | you knew?  | you knew all along and you never told me? | blown up? | you told me my parents died in a car crash. | muggle? | okay. | first year's students will require three sets of plain work robes one wand. | one pair of dragon hide gloves. | hagrid, do they mean from a real dragon? | you'd like a dragon? | all students must be equipped with one standard size 2 pewter cauldron and may bring, if they desire, either an owl, a cat or a toad. | can we find all this in london? | oh, nice to meet you. | goodbye. | but why am i famous, hagrid? | all those people back there, how is it they know who i am? | but, hagrid, how am i to pay for all this? | i haven't any money. | hagrid, what exactly are these things? | what's in there, hagrid? | i still need... a wand. | hello? | hello? | sorry, but what's curious? | and who owned that wand? | he killed my parents, didn't he? | the one who gave me this. | you know, hagrid.  | i know you do. | maybe if you wrote it down? | voldemort? | me? voldemort tried to kill me? | what happened to v...? | to you-know-who? | platform 9 3/4? | but, hagrid, there must be a mistake. | this says platform 9 3/4. | there's no such thing, is there? | excuse me. excuse me. | excuse me sir, can you tell me where i might find platform 9 3/4? | muggles? | excuse me. | could you tell me how to...? | no. not at all. | i'm harry. harry potter. | the what? | we'll take the lot. | bertie bott's every flavor beans? | these aren't real frogs, are they? | i've got dumbledore! | hey, he's gone! | just a little bit. | yeah. | hey, hagrid. | i think i can tell the wrong sort for myself, thanks. | nothing. nothing, i'm fine. | not slytherin, not slytherin! | say, percy, who's that teacher talking to professor quirrell? | what's he teach? | i think she fancies you. | we got lost. | i don't know, sir. | i don't know, sir. | clearly, hermione knows. | seems a pity not to ask her. | what's seamus trying to do to that glass of water? | can i borrow this? thanks. | hey ron! somebody broke into gringotts. | listen. | believed to be the work of dark wizards or witches unknown gringotts goblins while acknowledging the breach, insist nothing was taken. | the vault in question, number 713, had, in fact, been emptied earlier that very same day."" | that's odd.  | that's the vault hagrid and i went to. | give it here, malfoy. | give it here or i'll knock you off your broom! | a century, according to mcgonagall. | but i've never even played quidditch.  | what if i make a fool of myself? | i-i didn't know. | who doesn't? | what's happening? | let's go this way. | let's go. | run! quick, let's hide through that door! | it's locked! | and for good reason.  | guarding something? | i think so.  | what are those? | what was that? | i like this ball. | what do i do with it? | whoa. | i think we're going to need another feather over here, professor. | i think she heard you. | where's hermione? | how could a troll get in? | hermione!  | she doesn't know! | it's going into the girl's bathroom! | hermione, move! | whooa! whoa, whoa!  | do something! | anything!  | hurry up! | i don't think so.  | just knocked out.  |  ew. troll bogies. | good of you to get us out of trouble like that. | mind you, she might not have needed saving if you hadn't insulted her. | i'm not hungry. | that explains the blood. | listen, last night, i'm guessing snape let the troll in as a diversion so he could try and get past that 3 headed dog.  | but, he got himself bitten, that's why he's limping. | the day i was at gringotts, hagrid took something out of one of the vaults. |  he said it was hogwarts' business, very secret. | that's what the dog's guarding.  | that's what snape wants. | but i-i never get mail. | it's a broomstick! | but who...? | a little. | what happened? | yes! whoa! | yes! | whoa! whooa! | who knows.  | why was he trying to get past that 3 headed dog on halloween? | yes? | but hagrid, whatever fluffy's guarding, snape's trying to steal it! | exactly. | nicholas flamel? | nicholas flamel...who's nicholas flamel? | knight to e-5. | happy christmas, ron.  | what are you wearing? | i've got presents? | oh!  | your father left this in my possession before he died. | it is time it was returned to you. | use it well. | some kind of...cloak. | my body's gone! | i'm invisible?? | there was no name.  | it just said, ""use it well."" | famous fire eaters... | 15th century fiends...flamel... | nicholas flamel...where are you? | mum? dad?  | ron! you've really got to see this!  | ron! you've got to see this!  | ron, ron, come on. get out of bed! | there's something you've got to see.  | now, come on! | come on. come. come look, it's my parents! | look in properly. go on.  | stand there. there.  | you see them, don't you?  | thats my dad | how can it?  | both my parents are dead. | no. | no. | so, then it shows us what we want?  | whatever we want? | malfoy. | i found him! | go on! | i knew the name sound familiar. | i read it on the train that day. |  shh! | hagrid! | we think snape's trying to steal it. | hagrid, we know he's after the stone.  | we just don't know why. | what? | wait a minute. | one of the teachers? | uh, hagrid, what exactly is that? | norbert? | malfoy. | hagrid always wanted a dragon.  | he told me so the first time i met him. | i don't understand.  | 50?! |  hagrid, what's that? | if i didn't know better, draco, i'd say you were scared. | what is it, fang? | but what was that thing you saved me from? | but who would choose such a life? |  do you mean to say...that that thing that killed the unicorn... | that was drinking its blood...that was voldemort? | the sorcerer's stone. | but he's weak.  | he's living off the unicorns.  | don't you see? we had it wrong.  | snape doesn't want the stone for himself, he wants the stone for voldemort.  | with the elixir of life, voldemort will be strong again.  | he'll he'll come back.  |  i think if he'd had the chance, he might have tried to kill me tonight. | my scar. it keeps burning. | not like this. |  i think it's a warning. |  it means dangers coming. uhh!   | oh. of course! | don't you think it's a bit odd that what hagrid wants more than anything is a dragon, and a stranger shows up and just happens to have one? | i mean, how many people wander around with dragon eggs in their pockets?  | why didn't i see it before?  | hagrid, who gave you the dragon egg? |  what did he look like? | the stranger, though, you and he must have talked. |  and did he seem interested in fluffy? |  we have to see professor dumbledore, immediately! | he's gone?! now?  | but this is important!  | it's about...the sorcerer's stone. | someone's going to try and steal it. | that was no stranger hagrid met in the village.  | it was snape, which means he knows how to get past fluffy. | we go down the trapdoor. tonight. | trevor. | now, neville, listen. we were |  let's go. sorry. | snoring | snape's already been here.  | he's put a spell on the harp. | we have to move its paw. | come on! okay. push!  | i'll go first.  | don't follow until i give you a sign. | if something bad happens, get yourselves out… | does it seem a bit...quiet to you? | jump! go!  | whoa! oh. ahh! | hermione! where are you?! | yeah, yeah, i'm fine. | apparently not. | what? | ron, are you okay? | okay. | lucky hermione pays attention in herbology. | i don't know.  | sounds like wings. | they're not birds, they're keys.  | and i'll bet one of them fits that door.  | i don't know. strange. | there! i see it! | the one with the broken wing! | it's too simple. | catch the key! | where are we? a graveyard. | there's the door. | wait a minute. | no, ron! no! | he's going to sacrifice himself! | ron!  | no! don't move! dont forget, we're still playing.  | checkmate.  | take care of ron. then, go to the owlery.  | send a message to dumbledore.  | ron's right...i have to go on. | not as good as you. | you? no. it can't be...snape. he was the one | b-but, that day, during the quidditch match, snape tried to kill me. | snape was trying to...save me? | th-then you let the troll in. | i-i'm shaking hands with dumbledore.  | i've won the house cup. | voldemort. | never! | you liar! | ahhhhhhhhh! | admirers? | ron was here?  | is he all right?  | what about hermione? | but, what happened to the stone? | but flamel, he'll die, won't he? | how is it i got the stone, sir?  | one minute i was staring in the mirror, and the next... | does that mean, with the stone gone, i mean, that voldemort can never come back? | what is it? | all right there, ron? | all right. hermione? | good job. | one minute.  | thanks, hagrid.  | but hagrid, we're not allowed to do magic away from hogwarts. you know that. | i'm not going home. not really. | i can’t let you out, hedwig.  | i’m not allowed to use magic outside of school.  | besides, if uncle vernon… | now you’ve done it. | but she’s bored!  | if i could only let out for an hour or two | but i haven’t had any messages from any of my friends... not one… all summer. | i’ll be in my bedroom, making no noise and pretending that i don’t exist. | who are you? | not to be to be rude or anything, but this isn’t a great time for me to have a house elf in my bedroom. | why don’t you sit down? | dobby, ssh! i’m sorry!  | i didn’t mean to offend you, or anything. | you can’t have met many decent wizards then. | stop, dobby! | dobby, shh! | dobby, please stop! | stop! stop, dobby.  | please be quiet!  | are you all right? | your family? | what terrible things?  | who’s plotting them? | ok– i- understand. you can’t- say. | dobby! dobby, put the lamp down. | give me the lamp! dobby stop! | get in there, and keep quiet! | i- i was just— | sorry. | yes, sir... see why i’ve got to go back?  | i don’t belong here.  | i belong in your world, at hogwarts.  | it’s the only place i’ve got friends! | well, i expect they’ve... been- hang on-  | how do you know my friends haven’t been writing to me? | give me those, now! | dobby, get back here! | dobby, please, no! | i can’t. hogwarts is my home! | ron! fred. george.  | what are you all doing here? | ahh- ahh! | let go of me! | get off! | i think it’s brilliant | hello. w-what did i do? | raids? | oh, sorry sir. i’m harry, sir, harry potter. | oh, umm... | floo powder? | diagonally. | i'm fine, thank you. i was just going... |  no. please... | hagrid! | i was lost, i... | hang on. | what were you doing down there then? | it's great to see you too. | i definitely need to remember that one. | thank you. bye. | voldemort killed my parents. | he was nothing more than a murderer. | let's go. | sorry. | lost control of the trolley. | why can't we get through? | the train leaves at exactly 11:00. | we've missed it. | maybe we should just go and wait by the car. | ron, i should tell you most muggles aren't accustomed to seeing a flying car. | come on, then. let's go lower. | we need to find the train. | all we need to do is catch up with the train. | do you hear that? | hold on. | i'm trying. your hand's all sweaty. | i think we found the train. | up! up! | up! ron, mind that tree! | be thankful it's not your neck. | i don't know. | come on, go! fast! | see you, hedwig. | so a house-elf shows up in my bedroom we can't get through the barrier to platform 93/4... | we almost get killed by a tree... | clearly someone doesn't want me here this year. | professor dumbledore. | professor mcgonagall. | you're doomed. | hi, colin. nice to meet you. | stop. hold still! | malfoy? | no, colin, get out of the way. | let's take him to hagrid's. | he'll know what to do. | malfoy. he called hermione... | well, i don't know exactly what it means. | what's a mudblood? | that's horrible. | not really. | what? | that voice. | didn't you hear it? | spooky. | did you hear it? | that voice. | i heard it first in lockhart's office. | and then again just... | it's moving. | i think it's going to kill. | strange. | i've never seen spiders act like that. | oh, no. | it's filch's cat. | it's mrs. norris. | no. no. | it's not true, sir. i swear. | i never touched mrs. norris. | when i said i wasn't hungry. | we were heading back to the common room when we found mrs. norris. | strange? | do you think i should have told them? | dumbledore and the others, i mean? | if there really is a chamber of secrets, and it has been opened, that means...  | maybe ron's right, hermione. | i mean, look at his family. | the whole lot of them have been in slytherin for centuries. | how long will it take to make? | a month? | but, hermione, | if malfoy is the heir of slytherin he could attack half the muggle-borns in the school by then. | wood, look out! | thank you. | no. i think my arm is broken. | no, not you. | dobby? | it was you.  | you stopped the barrier from letting ron and me through. | you nearly got ron and me expelled. | your bludger? you made that bludger chase after me? | you better clear off before my bones come back dobby, or i might strangle you. | i don't suppose you could tell me why you're trying to kill me? | why do you wear that thing, dobby? | repeat itself? you mean this has happened before? | stop it! | stop it, dobby! | tell me dobby when did this happen before? | who's doing it now? | no, dobby. tell me. | who is it? | thank you, sir. | you wish. | rictusempra! | i'm a what? | i know. i accidentally set a python on my cousin dudley at the zoo once. | once. but so what? | i bet loads of people here can do it. | what's bad? if i hadn't told that snake not to attack justin... | you were there. you heard me. | i spoke a different language? | but i didn't realize... | how can i speak a language without knowing i can? | but i'm not. | i can't be. | i'll see you back in the common room. | no. mr. filch! you don't understand... | professor i swear i didn't. | professor dumbledore? | i...i..i was just wondering if you put me in the right house. | you're wrong. | professor. | your bird...there was nothing i could do. | he just caught fire. | you don't think it was me, professor? | no, sir. nothing | crabbe and goyle. | ron, maybe i should do it. | wingardium leviosa. | come on, let's get them. | ron. | we still sound like ourselves. | you need to sound more like crabbe. | excellent. | hermione, are you okay? | come on. | i think the slytherin common room's this way. | i'm... | ah- um.. reading. | you're wrong! | harry potter? | but then you must have some idea who's behind it all. | it's his stomachache. | calm down. | hair! | hermione, come out. | we've got loads to tell you. | hermione? | are you okay? | she should be out of hospital in a few days when she stops coughing up fur balls. | what's this? | looks like moaning myrtle's flooded the bathroom. | why would i throw something at you? | but who threw it at you, anyway? | ""tom marvolo riddle."" | my name is harry potter. | do you know anything about the chamber of secrets? | can you tell me? | excuse me.  | could you tell me what's going on here? | are you tom riddle? | hello, can you hear me? | dumbledore? | hagrid! | haagriiid! | wow! | it was hagrid.  | hagrid opened the chamber of secrets 50 years ago. | the monster had killed somebody, ron. | what would any of us have done? | what's that you've got, hagrid? | and they found it. | tom riddle's diary is gone. | no. | we've got to talk to hagrid, ron. | i can't believe it's him but if he did set the monster loose last time he'll know how to get inside the chamber of secrets. that's a start. | i think it's time to get my dad's old cloak out again. | what's that for? | hagrid, are you okay? | did you hear about hermione? | look, we have to ask you something. | do you know who's opened the chamber of secrets? | look. | come on. | come on, fang. | come on. | you heard what hagrid said. | follow the spiders. | shush! | come on. | don't panic. | we're friends of hagrid's. | and you? | you're aragog, aren't you? | he's in trouble. up at the school, there have been attacks. | they think it's hagrid. | they think he opened the chamber of secrets. like before. | then you're not the monster? | but if you're not the monster, then what did kill that girl 50 years ago? | but have you seen it? | what? | well, thank you. | we'll just go. | one, but it's not powerful enough for all of them. | let's go! | arania exumai! | go! | arania exumai! | don't mention it. | get us out of here. | now! | come on! | come on, move faster! | come on! go! | get us in the air. | come on! pull! | we know one thing. | hagrid never opened the chamber of secrets. | he was innocent. | wish you were here, hermione. | we need you. | now more than ever. | ron... | this is why hermione was in the library the day she was attacked. | come on. | of the many fearsome beasts that roam our land none is more deadly than the basilisk. | capable of living for hundreds of years instant death awaits any who meet this giant serpent's eye. | spiders flee before it. | ron, this is it. | the monster in the chamber of secrets is a basilisk. | that's why i can hear it speak. | it's a snake. | because no one did look it in the eye. | not directly, at least. | colin saw it through his camera. | justin... justin must have seen the basilisk through nearly headless nick. | nick got the full blast of it. | but he's a ghost, he couldn't die again. | and hermione had the mirror. | i bet you she was using it to look around corners in case it came along. | the water. | there was water on the floor that night. | she only saw the basilisk's reflection. | spiders flee before it. | it all fits. | hermione's answered that too. | remember what aragog said about that girl 50 years ago? | she died in a bathroom? | what if she never left? | lockhart may be useless, but he's going to try and get into the chamber. | at least we can tell him what we know. | professor, we have some information for you. | are you going somewhere? | you're running away? | after all you did in your books? | you wrote them. | you're a fraud. | you've been taking credit for what other wizards have done. | don't even think about it. | to ask you how you died. | who was it, myrtle? | just like that? how? | this is it. | this is it, ron. i think this is the entrance to the chamber of secrets. | yes, there is. | you first. | all right. let's go. | thanks, myrtle. | now, remember: any sign of movement, close your eyes straightaway. | this way. | it's a snake skin. | ron! ron, are you okay? | you wait here and try and shift some of this rock so we can get back through. | i'll go on and find ginny. | ginny! ginny, please don't be dead. | wake up, wake up. | please wake up. | tom. tom riddle. | what do you mean, she won't wake? | she's not...? | are you a ghost? | she's cold as ice. | ginny, please don't be dead. wake up. | you've got to help me, tom. | there's a basilisk. | give me my wand, tom. | we've got to go. we've got to save her. | no. she couldn't. she wouldn't. | but why? | and why did you want to meet me? | hagrid's my friend. | and you framed him, didn't you? | i'll bet dumbledore saw right through you. | well, you haven't finished it this time. | in a few hours, the mandrake draught will be ready. | and everyone who was petrified will be all right again. | why do you care how i escaped? | voldemort was after your time. | you. you're the heir of slytherin. | you're voldemort. | albus dumbledore is the greatest sorcerer in the world. | he'll never be gone.  | not as long as those who remain are loyal to him. | fawkes? | ginny? | ginny? | don't worry. | ginny, you need to get yourself out. | follow the chamber and you'll find ron. | you were brilliant, fawkes. | i just wasn't quick enough. | of course. | phoenix tears have healing powers. | thanks. | it's all right, ginny. | it's over. | it's just a memory. | it's just... | you see, sir, i couldn't help but notice certain things, certain... | certain similarities between tom riddle and me. | voldemort transferred some of his powers to me? | so the sorting hat was right. | i should be in slytherin. | because i asked it to. | godric gryffindor. | dobby. | so this is your master. | the family you serve is the malfoys. | don't worry. i will be. | sir? i wonder if i could have that? | mr. malfoy. | mr. malfoy! | i have something of yours. | i think you do, sir. | i think you slipped the diary into ginny weasley's cauldron that day at diagon alley. | open it. | just promise me something. | never try to save my life again. | we had loads of help from you. | we couldn't have done it without you. | there's no hogwarts without you, hagrid. | lumos maxima... | lumos maxima... | lumos maxima... | lumos... maxima! | uncle vernon. i need you to sign this form. | nothing. school stuff | i will if she does. | yes. | okay. | oh, yeah. | yeah. i've been beaten loads of times. | that's a lie. | my dad wasn't a drunk. | shut up! shut up! | no. she deserved what she got. | keep away from me. | yeah? try me. | i don't care. | anywhere is better than here. | i fell over. | i didn't do it on purpose. | nothing. | i didn't. | he leaky cauldron. that's in london. | but the muggles. can't they see us? | who is that? that man. | how did he escape? | yeah. him i've heard of. | hedwig. | no, thank you. minister? | i don't understand. | i broke the law. underage wizards can't use magic at home. | the state of things, sir? | sirius black, you mean? | but what's he got to do with me? | hedwig. | egypt. what's it like? | mrs. weasley. | good to see you too. | yes. | it's all upstairs. | everything. | thank you. | mr. weasley. | yeah, sure. | yeah. it should be great. | has this anything to do with sirius black, sir? | only that he's escaped from azkaban. | voldemort. | sorry. | and kill me. | mr. weasley why would i go looking for someone who wants to kill me? | i didn't mean to blow her up. i just...i lost control. | i was lucky not to be arrested actually. | do you think he's really asleep? | i gotta tell you something. | yeah. | thanks, ron. | i don't know. | maybe we've broken down. | thank you. | what was that thing that came? | what happened to me? | and did either of you two you know pass out? | but someone was screaming. | a woman. | how did he find out? | fortuna major. | fortuna major. | thank you. | still doing that after three years. | she can't even sing. | hey, man. | shut up, malfoy. | what? | hey, hey, hey! | brilliant, professor. | at least hagrid didn't get fired. | i thought if you signed it, then i could... | forget about it, guys. see you later. | professor, can i ask you something? | i did think of voldemort at first. | but then i remembered that night on the train and the dementor. | before i fainted i heard something. | a woman screaming. | i think it was my mother the night she was murdered. | haunted building in britain. i know. | what's going on? | excuse me, sir. | where's professor lupin? | it's quidditch tomorrow. | probably a right sight better than he normally does. | oh, brilliant. | what happened? | really? i meant the match. who won? | no. | professor, why do the dementors affect me so? | i mean, more than everyone else? | i'm scared, professor. | i need to know how to fight them. | you could teach me. | you made the one on the train go away. | but you made it go away. | guys, let me go. | i'm trying to get to hogsmeade. | let me go! come on, guys. don't... | what are you doing?! | what's this rubbish? | messrs. moony, wormtail, padfoot and prongs are proud to present the marauder's map. | hang on. this is hogwarts. and that… | no. is that really...? | so you mean this map shows... | everyone? | brilliant! where did you get it? | he was their friend and he betrayed them. | he was their friend! | i hope he finds me. | because when he does, i'm gonna be ready! | when he does, i'm gonna kill him! | i'm sure. | yes. | expecto patronum. | shall we? wand at the ready. | expecto patronum! | expecto... expecto...expect... | that's one nasty dementor. | the first time i rode a broom. | there's another. | it's not happy, exactly. | well, it is. | it's the happiest i've ever felt but it's complicated. | just do it. | expecto patronum! | expecto patronum! | i think i've had enough for today. | i was thinking of him. and mum. | seeing their faces. | they were talking to me. | just talking. | that's the memory i chose. | i don't even know if it's real. | but it's the best i have. | ripped to pieces? | what are you talking about? | tell those spiders. | sorry. | mischief managed. nox. | i was sleepwalking. | my dad didn't strut. and nor do i. | if you don't mind, i would appreciate it if you could lower your wand. | spare bit of parchment. | messrs. moony, wormtail, padfoot, and prongs offer their compliments to professor snape and... | and request he keep his large nose out of other people's business. | no, sir. | yes, sir. | professor, just so you know, i don't think that map always works. | earlier, it showed someone in the castle. | someone i know to be dead. | peter pettigrew. | it's just what i saw. | good night, professor. | hang on. | we better take this back. | fine. see you later. | professor trelawney... | sorry? | no. nothing. | why don't we just set him free? | hagrid! | hagrid. | it'll be fine. it'll be okay. | what? | oh, no. | ron! | wait! | that's not good. ron, run! | ron! ron, wait! | ron! | ron. ron. | come on! | move! | don't worry. | i have a hunch. | i just hope i'm wrong. | come on. | ron. | the dog. where is it? | then it'll be you! | i know why. | you betrayed my parents. | you're the reason they're dead! | who was it, then? | expelliarmus! | tell me about peter. | no. pettigrew's dead. you killed him! | the map was lying, then. | all they could find of pettigrew was his... | show me. | give it to him, ron. | no! | i know what he is. | but we'll take him to the castle. | get off! | i said we'd take you to the castle. | after that, the dementors can have you. | okay. | no. don't worry, okay? | it's fine. i'll stay. | you okay? | i didn't think my dad would have wanted his best friends to become killers. | besides, dead, the truth dies with him. | alive, you're free. | i know. | what? come and live with you? | expelliarmus! | come on. | sirius! | sirius! | no. sirius! | expecto patronum! | i saw my dad. | he sent the dementors away. | i saw him across the lake. | they're gonna kill him? | it's true sir. sirius is innocent. | what just happened? | where's ron? | i don't know. going to hagrid's? | hermione! | hermione! hermione, wait. | hermione, will you please tell me what it is we're doing? | that's us. | this is not normal. | you mean we've gone back in time? | good punch. | come on. we should be at hagrid's. | look. buckbeak's still alive. | here they come. i'd better hurry. | that's pettigrew. | hermione that's the he betrayed my parents. | you don't expect me to sit here. | are you mad? | that hurt. | what? | get away. get off. | okay, buckbeak. come quickly.  | come with us now. come on. | buckbeak. okay? | quickly. hurry up. okay? | hurry up now, buckbeak, okay? | this way. | this way. | this way, now. | now what? | how? | and now we wait. | yeah. | hermione? | before, down by the lake, when i was with sirius i did see someone. | that someone made the dementors go away. | it was my dad. | it was my dad conjured the patronus. | dead. i know. | i'm just telling you what i saw. | you see sirius talking to me there? | he's asking me to come live with him. | when we free him, i'll never have to go back to the dursleys'. | it'll just be me and him. | we could live in the country someplace you can see the sky. | he'll like that after all those years in azkaban. | let's go. | what are you doing? | thanks. | great. now he's coming for us. | poor professor lupin's having a really tough night. | sirius. come on! | don't worry. | my dad will come. | he'll conjure the patronus. | any minute now. | right there. you'll see. | don't worry, he will. | he will come. | sirius. | expecto patronum! | you were right, hermione. | it wasn't my dad i saw earlier. it was me! | i saw myself conjuring the patronus before. | i knew i could do it this time because well, i had already done it. | does that make sense? | i want to go with you. | but you're innocent. | my mother's eyes. | he's free. we did it. | i don't know. | honestly, ron. how can somebody be in two places at once? | you've been sacked. | resigned? why? | but dumbledore... | none of it made any difference. | pettigrew escaped. | what are you talking about? | for me? | but who sent it? | lumos. | i solemnly swear that i am up to no good. | mischief managed. | nox."
