Character;EXT;NEU;AGR;CON;OPN;Sentence
oliver;1;1;0;0; er, i don't really remember.  
oliver;1;1;0;0; i took a bludger to the head 2 minutes in.  
oliver;1;1;1;0; woke up in the hospital a week later.
flitwick;1;0;0;0;one of a wizard's most rudimentary skills is levitation the ability to make objects fly.  
flitwick;1;1;1;0; uh, do you all have your feathers? good.  
flitwick;0;0;0;1; now, uh, don't forget the nice wrist movement we've been practicing, hmm?  
flitwick;1;1;0;0; the swish and flick. everyone.  
flitwick;1;1;1;0; good.  
flitwick;1;1;0;0; and enunciate.  
flitwick;1;1;0;0; wingardium leviosa.  
flitwick;1;1;1;0; off you go then. 
flitwick;1;1;0;1; oh, well done!  
flitwick;1;0;1;0; see here, everyone!  
flitwick;1;1;0;1; ms. granger's done it!  
flitwick;1;1;1;0; oh, splendid! 
flitwick;1;1;1;0; whooaaa! ooh.
draco;1;1;0;0;wingardium levio-saaa. 
draco;1;1;0;0; no! 
draco;1;1;0;0; can i have this? 
draco;1;1;0;1;  it's not my fault the teachers have favorites.  
draco;1;1;0;0; that hermione granger -- 
draco;1;1;1;1; i'll bet you loved that, didn't you, potter? 
draco;1;1;0;0; famous harry potter. 
draco;1;1;0;0; can't go into a bookshop without making the front page. 
draco;1;1;1;1; look, potter. 
draco;1;1;0;0; you've got yourself a girlfriend. 
draco;1;0;0;0; see you at school. 
draco;1;1;0;0; that's right. 
draco;1;1;0;0; and that's not all that's new this year. 
draco;1;0;1;1; you see, weasley, unlike some, my father can afford the best. 
draco;1;1;0;0; no one asked your opinion, you filthy little mudblood. 
draco;1;1;0;0; enemies of the heir, beware. 
draco;1;1;0;0; you'll be next, mudbloods. 
draco;1;1;0;0; all right there, scarhead? 
draco;1;0;0;1; training for the ballet, potter!! 
draco;1;1;1;1; you'll never catch me, potter. 
draco;0;1;0;1; scared, potter? 
draco;1;1;0;0; everte statum! 
draco;1;1;0;0; serpensortia! 
draco;1;1;1;0; crabbe, goyle, where have you been? 
draco;1;1;0;0; pigging out in the great hall all this time? 
draco;1;0;1;0; why are you wearing glasses? 
draco;1;1;1;0; reading? 
draco;1;1;0;0; i didn't know you could read. 
draco;1;1;1;0; and what are you doing down here, weasley? 
draco;1;1;0;0; well, sit down. 
draco;1;1;0;1; you'd never know the weasleys were pure-bloods, the way they behave. 
draco;1;1;1;1; they're an embarrassment to the wizarding world. all of them. 
draco;1;1;0;0; what's wrong with you, crabbe? 
draco;0;1;0;1; i'm surprised the daily prophet hasn't done a report on all these attacks. 
draco;1;1;0;0; i suppose dumbledore is trying to hush it all up. 
draco;1;0;1;0; father always said dumbledore was the worst thing that ever happened to this place. 
draco;1;1;0;0; what? 
draco;1;1;0;0; you think there's someone here who's worse than dumbledore? 
draco;1;1;1;0; well? do you? 
draco;1;1;1;0; good one, goyle. 
draco;1;1;1;1; you're absolutely right. 
draco;1;1;0;0; saint potter. 
draco;1;1;0;0; and people actually think that he's the heir of slytherin? 
draco;1;1;0;0; you know i don't, goyle. 
draco;1;1;1;0; i told you yesterday. 
draco;1;1;1;0; how many times do i have to tell you? 
draco;1;1;0;0; is this yours? 
draco;1;1;1;0; but my father did say this: 
draco;1;1;0;0; it's been 50 years since the chamber was opened. 
draco;1;1;0;0; he wouldn't tell me who opened it. 
draco;1;1;1;0; only that they were expelled. 
draco;1;1;0;0; the last time the chamber of secrets was opened, a mudblood died. 
draco;1;1;0;1; so it's only a matter of time before one of them is killed this time. 
draco;1;1;0;0; as for me i hope it's granger. 
draco;1;1;1;0; what's the matter with you two? 
draco;1;1;1;0; you're acting very odd. 
draco;1;1;0;0; hey! where are you going? 
draco;1;1;0;0; potter. is it true you fainted? 
draco;1;1;0;0; i mean, you actually fainted? 
draco;1;1;1;0; exactly how do we do that? 
draco;1;1;0;0; don't be such a wimp, longbottom. 
draco;1;1;0;0; oh, yeah. terribly funny. 
draco;1;1;1;0; witty. god, this place has gone to the dogs. 
draco;1;0;1;0; wait until father hears dumbledore's got this oaf teaching classes. 
draco;1;1;0;0; dementor! dementor! 
draco;1;1;1;0; oh, please. 
draco;1;1;1;0; you're not dangerous at all, are you, you great ugly brute! 
draco;1;1;0;0; it's killed me! 
draco;1;1;1;1; you're gonna regret this. 
draco;1;1;0;0; you and your bloody chicken! 
draco;1;1;1;0; it comes and it goes. 
draco;1;1;0;0; still, i consider myself lucky. 
draco;1;1;1;1; madam pomfrey said another minute and i could've lost my arm. 
draco;1;1;0;0; i can't do homework for weeks. 
draco;1;1;0;0; this class is ridiculous. 
draco;1;1;1;0; well, well. look who's here. 
draco;0;1;1;0; you two shopping for your new dream home? 
draco;0;1;1;0; bit grand for you, isn't it, weasle-bee? 
draco;0;1;0;1; don't your family sleep in one room? 
draco;1;1;0;0; not very friendly. 
draco;0;1;0;0; boys, i think it's time we teach weasle-bee how to respect his superiors. 
draco;0;1;0;1; how dare you talk to me! 
draco;1;1;0;0; you filthy little mudblood! 
draco;1;1;0;0; who is that? 
draco;1;1;0;0; don't stand there! do something! 
draco;1;1;0;0; get out of the way! 
draco;1;1;0;0; move! 
draco;1;1;1;0; what did i say? father said i can keep the hippogriff's head. 
draco;1;1;1;0; i'll donate it to the gryffindors' room. 
draco;1;1;0;0; this is going to be rich. 
draco;1;1;0;0; come to see the show? 
draco;1;1;1;0; not a word to anyone, understood? 
draco;1;1;0;0; come to see the show? 
draco;1;1;1;0; not a word to anyone, understood? 
draco;1;1;1;1; i'm gonna get that jumped-up mudblood! mark my words.
ron and harry;1;1;0;0;well, what it is... 
ron and harry;1;1;0;0; the what? 
ron and harry;1;1;1;0;   hermione!!
oiiver;0;1;1;1;scared, harry?
lee jordan;1;1;0;1;hello, and welcome to hogwarts' first quidditch game of the season!  
lee jordan;1;1;0;0; today's game slytherin versus gryffindor!!! 
lee jordan;1;0;0;1; the players take their positions as madam hooch steps out onto the field to begin the game. 
lee jordan;1;0;1;0; the bludgers are up...followed by the golden snitch.  
lee jordan;1;1;0;0; remember, the snitch is worth 150 points.  
lee jordan;1;1;0;0; the seeker who catches the snitch ends the game. 
lee jordan;1;1;1;0; the quaffle is released...and the game begins! 
lee jordan;1;1;0;0; angelina johnson scores!  
lee jordan;1;1;0;0; 10 points for gryffindor!  
lee jordan;1;1;0;0; slytherin takes possession of the quaffle. 
lee jordan;1;1;0;0; bletchley passes to captain marcus flint. 
lee jordan;1;1;0;0;  another 10 points to gryffindor!  
lee jordan;1;1;0;0; another goal for slytherin! 
lee jordan;1;1;0;0; they lead gryffindor 90 to 30. 
lee jordan;1;1;1;1; harry potter has caught the snitch. 
lee jordan;1;1;1;0; gryffindor wins!
gryffindors;1;1;1;0;yay!
flint;1;1;0;0;give me that!  
flint;1;1;0;0; take that side! 
flint;1;1;0;0; quidditch practice. 
flint;1;1;0;0; easy, wood. i've got a note. 
flint;1;1;1;0; a gift from draco's father.
crowd;1;1;0;0;boooo!! 
crowd;1;1;1;0; go go gryffindor! go go gryffindor!  
crowd;1;1;1;0; go go gryffindor!!
lee  jordan;1;1;0;0;he's got the snitch!  
lee  jordan;0;1;0;0; harry potter receives 150 points for catching the snitch!
hermoine;1;1;1;1;and what, may i ask, do you plan to do if this comes up in the final exam? 
hermoine;0;0;0;0; no, you won't. 
hermoine;1;1;1;1; besides, according to professor mcgonagall, we're to be given special quills bewitched with an anti cheating spell.
all 3;1;1;0;0;we know about the sorcerer's stone!
firenze;1;1;0;0;harry potter, you must leave.  
firenze;1;1;0;0; you are known to many creatures here.  
firenze;1;0;1;1; the forest is not safe at this time.  
firenze;1;1;1;0; especially for you. 
firenze;1;1;0;0; a monstrous creature.  
firenze;1;1;0;0; it is a terrible crime to slay a unicorn.  
firenze;0;1;0;0; drinking the blood of a unicorn will keep you alive even if you are an inch from death.  
firenze;0;1;0;0; but at a terrible price.  
firenze;0;1;0;1; you have slain something so pure that the moment the blood touches your lips, you will have a half-life.  
firenze;1;1;0;0; a cursed life. 
firenze;1;1;0;0; can you think of no one? 
firenze;0;1;0;0; do you know what is hidden in the school at this very moment? 
firenze;1;1;1;0; harry potter, this is where i leave you.  
firenze;1;0;1;1; you're safe now. good luck.
voldemort;1;1;0;0;use the boy 
voldemort;1;1;0;0; he lies. 
voldemort;1;1;0;0; let me speak to him. 
voldemort;1;1;0;0; i have strength enough for this.  
voldemort;1;1;1;1; harry potter. we meet again. 
voldemort;1;1;0;0; yes. you see what i have become?  
voldemort;0;1;0;0; see what i must do to survive?  
voldemort;1;1;1;0; live off another. a mere parasite.  
voldemort;0;1;0;0; unicorn blood can sustain me, but it cannot give me a body of my own.  
voldemort;1;1;0;0; but there is something that can.  
voldemort;0;1;0;0; something, that conveniently enough, lies in your pocket! 
voldemort;1;1;0;0; stop him!  
voldemort;1;1;0;0; don't be a fool!  
voldemort;1;1;0;0; why suffer a horrific death when you can join me and live?! 
voldemort;1;1;1;0; haha. bravery. your parents had it too.  
voldemort;0;0;1;1; tell me, harry, would you like to see your mother and father again?  
voldemort;1;1;0;0; together, we can bring them back.  
voldemort;1;1;0;0; all i ask for is something in return.  
voldemort;1;1;1;0; that's it, harry.  
voldemort;1;1;0;0; there is no good and evil.  
voldemort;1;1;1;1; there is only power, and those too weak to seek it.  
voldemort;1;1;1;1; together, we'll do extraordinary things.  
voldemort;1;1;0;0; just give me the stone!  
voldemort;1;1;0;0; kill him! 
voldemort;1;1;0;0; fool! get the stone! 
voldemort;1;1;0;0; arrrhhhhhh!
students;1;1;0;0;whoo! yeah!
uncle vernon;1;1;1;1;iâ€™m warning you, if you canâ€™t control that bloody bird itâ€™ll have to go. 
uncle vernon;1;1;0;0; i should think youâ€™d be a little more grateful.  
uncle vernon;1;1;0;0; weâ€™ve raised you since you were a baby, given you the food off our table, even let you have dudleyâ€™s second bedroom, purely out of the goodness of our hearts. 
uncle vernon;1;1;0;0; which should be any minute!  
uncle vernon;1;1;1;1; ahem...now letâ€™s go over our schedule once again, shall we?  
uncle vernon;1;1;1;1; petunia when the masons arrive you will be...? 
uncle vernon;1;1;1;0; good! and- and dudley, you will be...? 
uncle vernon;1;1;0;1; excellent! ...and you...? 
uncle vernon;1;1;1;0; too right, you will.  
uncle vernon;1;0;0;1; with any luck, this could well be the day i make the biggest deal of my career.  
uncle vernon;1;1;0;0; and you will not mess it up! 
uncle vernon;1;1;1;0; mr. and mrs. mason! do come in! 
uncle vernon;1;1;0;1; ohh, donâ€™t mind that!  
uncle vernon;0;1;0;0; itâ€™s just the cat. 
uncle vernon;1;1;0;0; what the devil are you doing up here? 
uncle vernon;1;1;0;0; you just ruined the punch line of my japanese golfer joke! 
uncle vernon;1;1;0;0; one more sound, and youâ€™ll wish youâ€™d never been born, boy!  
uncle vernon;1;1;0;0; and fix that door! 
uncle vernon;0;0;0;1; ...it spread as far as the eye could see, all over the floor of this vast building, and it was this deep.  
uncle vernon;1;1;1;0; and one plumber said â€œlook at all that water.â€  
uncle vernon;1;1;0;1; a-and the second plumber said, â€œyes, and thatâ€™s just the top of it!â€ 
uncle vernon;1;1;1;0; iâ€™m so sorry! itâ€™s my nephew- heâ€™s very disturbed.  
uncle vernon;1;1;0;1; meeting strangers upsets him.  
uncle vernon;1;0;0;0; thatâ€™s why i kept him upstairs! 
uncle vernon;1;1;1;1; youâ€™re never going back to that school.  
uncle vernon;1;1;1;0; youâ€™re never going to see those freaky friends of yours again. never! 
uncle vernon;1;0;1;0; now, what the hellâ€™s he doing? potter! 
uncle vernon;1;1;1;0; petunia, heâ€™s escaping! 
uncle vernon;1;1;0;0; come here! 
uncle vernon;1;1;0;0; oh no, boy! you and thatÂ bloodyÂ pigeonÂ arenâ€™tÂ goingÂ anywhere! 
uncle vernon;1;1;0;0; no! no! no! no! aaaah! 
uncle vernon;1;1;0;0; oh... damn. 
uncle vernon;1;1;0;0; what is it? 
uncle vernon;0;1;1;0; later perhaps. if you behave. 
uncle vernon;1;1;0;0; take marge's suitcase upstairs. 
uncle vernon;1;1;1;0; can i tempt you, marge? 
uncle vernon;1;1;1;0; st. brutus'. it's a fine institution for hopeless cases. 
uncle vernon;1;1;0;0; i think it's time you went to bed. 
uncle vernon;1;1;0;0; stop! 
uncle vernon;1;1;0;0; i've got you, marge. i've got you. 
uncle vernon;1;1;0;1; hold on, hold on. 
uncle vernon;1;1;1;0; get off. 
uncle vernon;1;1;1;0; sorry. 
uncle vernon;1;1;0;0; oh, god. marge! 
uncle vernon;1;1;0;0; please! marge! come back! 
uncle vernon;1;1;0;0; you bring her back! 
uncle vernon;1;1;0;0; you bring her back now. 
uncle vernon;1;1;0;0; you put her right! 
uncle vernon;0;1;1;0; you can't do magic outside school. 
uncle vernon;1;1;0;0; they won't let you back now. 
uncle vernon;0;1;0;0; you've nowhere to go.
aunt petunia;1;1;0;0;not now, pupkins. for when the masons arrive. 
aunt petunia;1;1;1;0; in the lounge, waiting to welcome them graciously into our home. 
aunt petunia;1;1;0;0; oh! 
aunt petunia;1;1;1;0; harry! harry! 
aunt petunia;1;1;1;0; harry!! open the door. 
aunt petunia;1;1;0;0; marge! how lovely to seeâ€¦ 
aunt petunia;1;1;0;0; nothing. he didn't work. 
aunt petunia;1;1;0;0; he was unemployed. 
aunt petunia;1;1;0;0; oh, vernon.
dobby;0;1;0;0;ha- ha- ha! ha, ha! ho, ho, ho! ha, ha!  
dobby;1;1;1;1; harry potter! such an honor it is! 
dobby;1;1;0;0; dobby sir, dobby the house elf. 
dobby;1;1;0;1; oh, oh yes, sir! dobby understands!  
dobby;1;1;0;0; itâ€™s just that, dobby has come to tell you- it is difficult, sir 
dobby;1;1;0;1;  dobby wonders where to begin? 
dobby;1;1;0;0; s-sit down? s-sit- sit down?  
dobby;1;1;0;0; oh, oh, ho. oh, ho, ho... oh, ho, ho. 
dobby;1;1;0;0; offend dobby?  
dobby;1;1;1;1; dobby has heard of your greatness, sir, but never has he been asked to sit down by a wizard, like an equal. 
dobby;1;1;0;0; no, i havenâ€™t.  
dobby;1;0;1;0; that was an awful thing to say.  
dobby;1;1;0;0; bad dobby! 
dobby;1;1;0;0; bad dobby! 
dobby;1;1;0;0; baaad dobby! 
dobby;1;1;0;0; bad dobby.  
dobby;1;1;0;0; bad dobby! 
dobby;1;1;0;0; dobby had to punish himself, sir.  
dobby;1;1;0;0; dobby almost spoke ill of his family, sir. 
dobby;1;1;1;0; the wizard family dobby serves, sir.  
dobby;1;1;1;1; dobby is bound to serve one family forever.  
dobby;1;1;1;1; if they ever knew dobby was here...ooh...  
dobby;1;1;1;0; but dobby had to come.  
dobby;1;1;1;1; dobby has to protect harry potter- to warn him.  
dobby;1;1;0;1; harry potter must not go back to hogwarts school of witchcraft and wizardry this year!  
dobby;1;1;1;1; there is a plot, a plot to make most terrible things happen. 
dobby;1;1;1;0; ooo... er... canâ€™t... say... argh... 
dobby;1;0;0;1; donâ€™t make me talk, iâ€” errr... 
dobby;1;1;0;0; bad dobby. 
dobby;1;1;0;0; let me go! 
dobby;1;1;0;0; friends who donâ€™t even write to harry potter? 
dobby;1;1;1;1; harry potter mustnâ€™t be angry with dobby.  
dobby;1;1;1;1; heh- dobby hoped, if harry potter thought his friends had forgotten him, harry potter might not want to go back to school, sir. 
dobby;1;1;0;0; no! ahh! ooh... 
dobby;1;1;0;1; harry potter must say heâ€™s not going back to school! 
dobby;1;1;0;1; then, dobby must do it, sir, for harry potterâ€™s own good.  
dobby;1;1;0;0; hello. 
dobby;0;1;0;1; harry potter should have listened to dobby. 
dobby;1;1;0;1; harry potter should have gone back home when he missed the train. 
dobby;1;1;1;0; indeed. yes, sir. 
dobby;1;1;1;0; at least you would be away from here. 
dobby;1;1;0;1; harry potter must go home. 
dobby;1;0;0;1; dobby thought his bludger would be enough to make harry potter see... 
dobby;1;1;0;0; dobby feels most aggrieved, sir. 
dobby;1;1;1;0; dobby had to iron his hands. 
dobby;1;1;0;1; dobby is used to death threats, sir. 
dobby;1;1;1;0; dobby gets them five times a day at home. 
dobby;1;1;0;0; not kill you, sir. 
dobby;1;1;0;0; never kill you. 
dobby;0;1;0;1; dobby remembers how it was before harry potter triumphed over he-who-must-not-be-named. 
dobby;1;1;0;0; we house-elves were treated like vermin, sir. 
dobby;1;1;1;0; of course, dobby is still treated like vermin. 
dobby;1;1;0;0; this, sir? it is a mark of the house-elf's enslavement. 
dobby;1;1;0;0; dobby can only be freed if his master presents him with clothes. 
dobby;1;1;0;0; listen. 
dobby;1;1;0;0; listen! 
dobby;1;1;1;0; terrible things are about to happen at hogwarts. 
dobby;1;1;0;0; harry potter must not stay here...now that history is to repeat itself. 
dobby;1;1;0;0; oahh! i shouldn't have said that. 
dobby;1;1;0;0; bad dobby! bad! 
dobby;1;1;0;0; dobby cannot say, sir.  
dobby;0;1;0;1; dobby only wants harry potter to be safe. 
dobby;1;1;0;0; master has given dobby a sock. 
dobby;1;1;1;0; master has presented dobby with clothes. 
dobby;1;1;0;0; dobby is free. 
dobby;1;1;1;1; you shall not harm harry potter. 
dobby;1;1;1;1; harry potter freed dobby. 
dobby;1;1;1;0; how can dobby ever repay him? 
dobby;1;1;0;0; anything, sir.
auntÂ petuniaÂ & dudley;1;1;0;0;aaah!
mr. weasley;1;1;0;0;morning, weasleys. 
mr. weasley;1;1;1;0; what a night. nine raids. nine! 
mr. weasley;1;1;0;0; well now. aah! and who are you? 
mr. weasley;1;1;1;0; good lord! are you really?  
mr. weasley;1;1;1;0; well, ronâ€™s told us allÂ aboutÂ you, of course. 
mr. weasley;1;1;1;0; when did he get here? 
mr. weasley;1;1;1;0; did you really? howâ€™d it go? did youâ€” 
mr. weasley;1;1;1;0; i mean...that was very wrong, indeed, boys.  
mr. weasley;1;1;0;0; veryÂ wrongÂ of you 
mr. weasley;1;1;0;1; now, harry, you must know allÂ aboutÂ muggles.  
mr. weasley;1;1;0;0; tell me, whatÂ exactlyÂ is theÂ functionÂ of aÂ rubberÂ duck? 
mr. weasley;1;1;0;0; dumbledoreÂ must know youâ€™re here, harry.  
mr. weasley;1;1;0;0; doesnâ€™t miss a trick, that man. 
mr. weasley;1;1;1;0; diagonally. 
mr. weasley;1;1;1;0; children, it's mad in here. 
mr. weasley;1;1;1;0; let's go outside. 
mr. weasley;1;1;0;0; lucius. 
mr. weasley;1;1;0;0; we have a very different idea about what disgraces the name of wizard, malfoy. 
mr. weasley;1;1;0;0; 10:58, come on. 
mr. weasley;1;1;0;1; fred, george, percy, you first. 
mr. weasley;1;1;1;0; after you, dear. 
mr. weasley;1;1;1;1; harry potter. 
mr. weasley;1;1;1;0; harry, wonder if i might have a word? 
mr. weasley;1;1;1;0; hermione. 
mr. weasley;1;0;0;1; looking forward to a new term? 
mr. weasley;1;0;1;0; harry, some within the ministry would strongly discourage me from divulging what i'm about to reveal to you. 
mr. weasley;1;1;0;0; but i think that you need to know the facts. 
mr. weasley;1;1;0;1; you are in danger. 
mr. weasley;1;1;0;1; grave danger. 
mr. weasley;1;1;1;1; what do you know about sirius black, harry? 
mr. weasley;1;1;0;0; do you know why? 
mr. weasley;1;1;0;0; thirteen years ago, when you stopped... 
mr. weasley;1;1;0;0; don't say his name. 
mr. weasley;1;1;0;1; when you stopped you-know-who black lost everything. 
mr. weasley;1;0;1;0; but to this day, he still remains a faithful servant. 
mr. weasley;1;0;1;1; and in his mind you are the only thing that stands in the way of you-know-who returning to power. 
mr. weasley;1;0;1;0; and that is why he has escaped from azkaban. 
mr. weasley;1;1;0;0; to find you. 
mr. weasley;1;0;1;0; harry, swear to me that whatever you might hear you won't go looking for black.
fred, george, ron;1;1;0;0;morning, dad.
fred, george, ron, harry;1;1;0;0;oh, it...
mr. borgin;1;1;1;0;mr. malfoy! what a pleasure to see you again.  
mr. borgin;1;1;0;1; if i may, just in today -- 
mr. borgin;1;1;0;0;  selling? 
mr. borgin;1;1;0;0; hmmm... yes. i see... 
mr. borgin;1;1;0;1; ah, the hand of glory.  
mr. borgin;1;1;0;0; insert a candle and it gives light only to the holder.  
mr. borgin;1;1;1;0; best friend of thieves and plunderers.  
mr. borgin;1;1;0;0; your son has fine taste, sir. 
mr. borgin;1;1;0;1; it's the same all over.  
mr. borgin;0;1;0;0; wizard blood is counting for less everywhere.
lucius malfoy;1;1;0;0;i'm not buying today, mr. borgin. 
lucius malfoy;1;1;0;0; but selling. 
lucius malfoy;1;1;1;1; you have heard, of course, that the ministry of magic is conducting more raids.  
lucius malfoy;0;1;1;1; there are even rumors of a new muggle protection act... 
lucius malfoy;1;1;0;0; i have a few... ah... items at home that might prove embarrassing if the ministry were to call. 
lucius malfoy;1;1;0;0; certain poisons and the like... 
lucius malfoy;1;1;1;0;  hopefully my son will amount to more than a thief, mr. borgin. 
lucius malfoy;1;1;0;0; though if his marks don't pick up -- 
lucius malfoy;0;1;1;0; i would have thought you'd be ashamed that a girl of no wizarding family beat you in every exam. 
lucius malfoy;1;1;1;0; not with me. 
lucius malfoy;1;1;1;0; very good.  
lucius malfoy;1;1;0;1; i'll expect you at the manor tomorrow.  
lucius malfoy;1;1;0;0; come, draco. 
lucius malfoy;0;1;0;0; now, now, draco, play nicely. 
lucius malfoy;1;1;1;0; mr. potter. 
lucius malfoy;1;1;0;0; lucius malfoy. we meet at last. 
lucius malfoy;1;1;1;0; forgive me. 
lucius malfoy;0;1;0;0; your scar is legend. 
lucius malfoy;1;1;1;1; as, of course, is the wizard who gave it to you. 
lucius malfoy;1;1;0;0; you must be very brave to mention his name. 
lucius malfoy;1;1;1;0; or very foolish. 
lucius malfoy;1;1;0;0; and you must be miss granger. 
lucius malfoy;1;1;0;0; yes, draco has told me all about you.  
lucius malfoy;1;1;1;0; and your parents. 
lucius malfoy;1;1;0;0; muggles, aren't they? 
lucius malfoy;1;0;0;0; let me see. 
lucius malfoy;1;1;0;0; red hair, vacant expressions tatty, secondhand book. 
lucius malfoy;1;1;0;0; you must be the weasleys. 
lucius malfoy;1;1;1;1; well, well, well. weasley senior. 
lucius malfoy;1;1;0;1; busy time at the ministry, arthur, all those extra raids? 
lucius malfoy;0;0;0;1; i do hope they're paying you overtime but judging by the state of this, i'd say not. 
lucius malfoy;1;1;0;0; what's the use in being a disgrace to the name of wizard if they don't even pay you well for it? 
lucius malfoy;1;1;0;1; clearly. 
lucius malfoy;1;1;0;0; associating with muggles. 
lucius malfoy;1;1;1;1; and i thought your family could sink no lower. 
lucius malfoy;1;0;0;0; i'll see you at work. 
lucius malfoy;1;1;1;1; already here, fudge? 
lucius malfoy;1;1;1;0; good. 
lucius malfoy;1;1;1;1; believe me i take absolutely no pleasure being inside your... 
lucius malfoy;1;1;0;0; you call this a house? 
lucius malfoy;1;1;0;0; no. 
lucius malfoy;1;1;0;0; i simply called up the school and was told the headmaster was here. 
lucius malfoy;0;0;0;0; the other governors and i have decided it's time for you to step aside. 
lucius malfoy;1;1;0;0; this is an order of suspension. 
lucius malfoy;1;1;0;0; you'll find all 12 signatures on it. 
lucius malfoy;0;1;0;1; i'm afraid we feel you've rather lost your touch. 
lucius malfoy;1;1;0;0; well, what, with all these attacks there'll be no muggle-borns left at hogwarts. 
lucius malfoy;0;1;0;0; i can only imagine what an awful loss that would be to the school. 
lucius malfoy;1;1;0;0; you think so? 
lucius malfoy;1;1;1;0; admirable sentiments. 
lucius malfoy;1;1;1;0; shall we? 
lucius malfoy;1;1;1;0; fudge. 
lucius malfoy;1;1;1;0; i'll deal with you later. 
lucius malfoy;1;1;0;0; out of my way, potter. 
lucius malfoy;1;1;1;0; so it's true. you have returned. 
lucius malfoy;1;1;0;0; ridiculous. 
lucius malfoy;1;1;0;1; how dare you! 
lucius malfoy;1;0;1;1; my sole concern has always been and will always be the welfare of this school and, of course, its students. 
lucius malfoy;1;1;1;0; the culprit has been identified, i presume? 
lucius malfoy;1;1;0;0; and? 
lucius malfoy;1;1;0;0; who was it? 
lucius malfoy;1;0;0;0; i see. 
lucius malfoy;1;1;0;0; well, let us hope that mr. potter will always be around to save the day. 
lucius malfoy;1;1;0;0; dumbledore. 
lucius malfoy;1;1;0;0; come, dobby. we're leaving. 
lucius malfoy;1;1;1;0; mine? i don't know what you're talking about. 
lucius malfoy;1;1;1;0; you do, do you? 
lucius malfoy;1;0;0;0; why don't you prove it? 
lucius malfoy;1;1;0;0; come, dobby. 
lucius malfoy;1;1;0;0; dobby. 
lucius malfoy;1;1;0;0; what? i didn't give... 
lucius malfoy;1;1;1;0; you lost me my servant! 
lucius malfoy;1;1;1;0; your parents were meddlesome fools too. 
lucius malfoy;1;1;1;1; mark my words, potter. 
lucius malfoy;0;0;0;0; one day soon you are going to meet the same sticky end.
photographer;1;1;0;1;make way there, please. 
photographer;1;1;0;0; let me by, madam. thank you. 
photographer;1;1;0;1; excuse me, little girl. 
photographer;1;1;0;0; this is for the daily prophet. 
photographer;1;1;1;1; harry potter! 
photographer;1;1;0;1; excuse me, madam.
lockhart;1;1;0;0;it can't be. harry potter? 
lockhart;1;1;1;1; nice big smile, harry. 
lockhart;1;1;0;0; together, you and i rate the front page. 
lockhart;1;1;0;1; ladies and gentlemen, what an extraordinary moment this is. 
lockhart;1;1;0;0; when young harry stepped into flourish and blotts this morning to purchase my autobiography, magical meâ€¦ 
lockhart;1;1;0;1; which, incidentally, is currently celebrating its 27th week atop the daily prophet bestseller list 
lockhart;1;1;0;0; he had no idea that he would, in fact, be leaving with my entire collected works free of charge. 
lockhart;1;1;0;0; now, ladies?
