Character,Tokens,Size_of_vocab,Avg_length,Prop_stop_word
harry,"yes aunt petunia yes uncle vernon hes asleep sorry about him he doesnt understand what its like lying there day after day watching people press their ugly faces in on you can you hear me its just ive never talked to a snake before do you i mean do you talk to people often youre from burma arent you was it nice there do you miss your family i see thats me as well i never knew my parents either mummy dad come here  anytime i swear i dont know one minute the glass was there and then it was gone it was like magic will i have to wear that too thats dudleys old uniform itll fit me like bits of old elephant skin hey give it back its mine because theres no post on sundays get off theyre my letters let go of me make a wish harry i am thank you excuse me who are you sorry no learnt what im a what no youve made a mistake i meanl cant be a wizard i mean im just harry just harry dear mr potter we are pleased to inform you that you have been accepted at hogwarts school of witchcraft and wizardry you knew  you knew all along and you never told me blown up you told me my parents died in a car crash muggle okay first years students will require three sets of plain work robes one wand one pair of dragon hide gloves hagrid do they mean from a real dragon youd like a dragon all students must be equipped with one standard size 2 pewter cauldron and may bring if they desire either an owl a cat or a toad can we find all this in london oh nice to meet you goodbye but why am i famous hagrid all those people back there how is it they know who i am but hagrid how am i to pay for all this i havent any money hagrid what exactly are these things whats in there hagrid i still need a wand hello hello sorry but whats curious and who owned that wand he killed my parents didnt he the one who gave me this you know hagrid  i know you do maybe if you wrote it down voldemort me voldemort tried to kill me what happened to v to youknowwho platform 9 34 but hagrid there must be a mistake this says platform 9 34 theres no such thing is there excuse me excuse me excuse me sir can you tell me where i might find platform 9 34 muggles excuse me could you tell me how to no not at all im harry harry potter the what well take the lot bertie botts every flavor beans these arent real frogs are they ive got dumbledore hey hes gone just a little bit yeah hey hagrid i think i can tell the wrong sort for myself thanks nothing nothing im fine not slytherin not slytherin say percy whos that teacher talking to professor quirrell whats he teach i think she fancies you we got lost i dont know sir i dont know sir clearly hermione knows seems a pity not to ask her whats seamus trying to do to that glass of water can i borrow this thanks hey ron somebody broke into gringotts listen believed to be the work of dark wizards or witches unknown gringotts goblins while acknowledging the breach insist nothing was taken the vault in question number 713 had in fact been emptied earlier that very same day thats odd  thats the vault hagrid and i went to give it here malfoy give it here or ill knock you off your broom a century according to mcgonagall but ive never even played quidditch  what if i make a fool of myself ii didnt know who doesnt whats happening lets go this way lets go run quick lets hide through that door its locked and for good reason  guarding something i think so  what are those what was that i like this ball what do i do with it whoa i think were going to need another feather over here professor i think she heard you wheres hermione how could a troll get in hermione  she doesnt know its going into the girls bathroom hermione move whooa whoa whoa  do something anything  hurry up i dont think so  just knocked out   ew troll bogies good of you to get us out of trouble like that mind you she might not have needed saving if you hadnt insulted her im not hungry that explains the blood listen last night im guessing snape let the troll in as a diversion so he could try and get past that 3 headed dog  but he got himself bitten thats why hes limping the day i was at gringotts hagrid took something out of one of the vaults  he said it was hogwarts business very secret thats what the dogs guarding  thats what snape wants but ii never get mail its a broomstick but who a little what happened yes whoa yes whoa whooa who knows  why was he trying to get past that 3 headed dog on halloween yes but hagrid whatever fluffys guarding snapes trying to steal it exactly nicholas flamel nicholas flamelwhos nicholas flamel knight to e5 happy christmas ron  what are you wearing ive got presents oh  your father left this in my possession before he died it is time it was returned to you use it well some kind ofcloak my bodys gone im invisible there was no name  it just said use it well famous fire eaters 15th century fiendsflamel nicholas flamelwhere are you mum dad  ron youve really got to see this  ron youve got to see this  ron ron come on get out of bed theres something youve got to see  now come on come on come come look its my parents look in properly go on  stand there there  you see them dont you  thats my dad how can it  both my parents are dead no no so then it shows us what we want  whatever we want malfoy i found him go on i knew the name sound familiar i read it on the train that day  shh hagrid we think snapes trying to steal it hagrid we know hes after the stone  we just dont know why what wait a minute one of the teachers uh hagrid what exactly is that norbert malfoy hagrid always wanted a dragon  he told me so the first time i met him i dont understand  50  hagrid whats that if i didnt know better draco id say you were scared what is it fang but what was that thing you saved me from but who would choose such a life  do you mean to saythat that thing that killed the unicorn that was drinking its bloodthat was voldemort the sorcerers stone but hes weak  hes living off the unicorns  dont you see we had it wrong  snape doesnt want the stone for himself he wants the stone for voldemort  with the elixir of life voldemort will be strong again  hell hell come back   i think if hed had the chance he might have tried to kill me tonight my scar it keeps burning not like this  i think its a warning  it means dangers coming uhh   oh of course dont you think its a bit odd that what hagrid wants more than anything is a dragon and a stranger shows up and just happens to have one i mean how many people wander around with dragon eggs in their pockets  why didnt i see it before  hagrid who gave you the dragon egg  what did he look like the stranger though you and he must have talked  and did he seem interested in fluffy  we have to see professor dumbledore immediately hes gone now  but this is important  its aboutthe sorcerers stone someones going to try and steal it that was no stranger hagrid met in the village  it was snape which means he knows how to get past fluffy we go down the trapdoor tonight trevor now neville listen we were  lets go sorry snoring snapes already been here  hes put a spell on the harp we have to move its paw come on okay push  ill go first  dont follow until i give you a sign if something bad happens get yourselves out… does it seem a bitquiet to you jump go  whoa oh ahh hermione where are you yeah yeah im fine apparently not what ron are you okay okay lucky hermione pays attention in herbology i dont know  sounds like wings theyre not birds theyre keys  and ill bet one of them fits that door  i dont know strange there i see it the one with the broken wing its too simple catch the key where are we a graveyard theres the door wait a minute no ron no hes going to sacrifice himself ron  no dont move dont forget were still playing  checkmate  take care of ron then go to the owlery  send a message to dumbledore  rons righti have to go on not as good as you you no it cant besnape he was the one bbut that day during the quidditch match snape tried to kill me snape was trying tosave me ththen you let the troll in iim shaking hands with dumbledore  ive won the house cup voldemort never you liar ahhhhhhhhh admirers ron was here  is he all right  what about hermione but what happened to the stone but flamel hell die wont he how is it i got the stone sir  one minute i was staring in the mirror and the next does that mean with the stone gone i mean that voldemort can never come back what is it all right there ron all right hermione good job one minute  thanks hagrid  but hagrid were not allowed to do magic away from hogwarts you know that im not going home not really i can’t let you out hedwig  i’m not allowed to use magic outside of school  besides if uncle vernon… now you’ve done it but she’s bored  if i could only let out for an hour or two but i haven’t had any messages from any of my friends not one… all summer i’ll be in my bedroom making no noise and pretending that i don’t exist who are you not to be to be rude or anything but this isn’t a great time for me to have a house elf in my bedroom why don’t you sit down dobby ssh i’m sorry  i didn’t mean to offend you or anything you can’t have met many decent wizards then stop dobby dobby shh dobby please stop stop stop dobby  please be quiet  are you all right your family what terrible things  who’s plotting them ok– i understand you can’t say dobby dobby put the lamp down give me the lamp dobby stop get in there and keep quiet i i was just— sorry yes sir see why i’ve got to go back  i don’t belong here  i belong in your world at hogwarts  it’s the only place i’ve got friends well i expect they’ve been hang on  how do you know my friends haven’t been writing to me give me those now dobby get back here dobby please no i can’t hogwarts is my home ron fred george  what are you all doing here ahh ahh let go of me get off i think it’s brilliant hello wwhat did i do raids oh sorry sir i’m harry sir harry potter oh umm floo powder diagonally im fine thank you i was just going  no please hagrid i was lost i hang on what were you doing down there then its great to see you too i definitely need to remember that one thank you bye voldemort killed my parents he was nothing more than a murderer lets go sorry lost control of the trolley why cant we get through the train leaves at exactly 1100 weve missed it maybe we should just go and wait by the car ron i should tell you most muggles arent accustomed to seeing a flying car come on then lets go lower we need to find the train all we need to do is catch up with the train do you hear that hold on im trying your hands all sweaty i think we found the train up up up ron mind that tree be thankful its not your neck i dont know come on go fast see you hedwig so a houseelf shows up in my bedroom we cant get through the barrier to platform 934 we almost get killed by a tree clearly someone doesnt want me here this year professor dumbledore professor mcgonagall youre doomed hi colin nice to meet you stop hold still malfoy no colin get out of the way lets take him to hagrids hell know what to do malfoy he called hermione well i dont know exactly what it means whats a mudblood thats horrible not really what that voice didnt you hear it spooky did you hear it that voice i heard it first in lockharts office and then again just its moving i think its going to kill strange ive never seen spiders act like that oh no its filchs cat its mrs norris no no its not true sir i swear i never touched mrs norris when i said i wasnt hungry we were heading back to the common room when we found mrs norris strange do you think i should have told them dumbledore and the others i mean if there really is a chamber of secrets and it has been opened that means  maybe rons right hermione i mean look at his family the whole lot of them have been in slytherin for centuries how long will it take to make a month but hermione if malfoy is the heir of slytherin he could attack half the muggleborns in the school by then wood look out thank you no i think my arm is broken no not you dobby it was you  you stopped the barrier from letting ron and me through you nearly got ron and me expelled your bludger you made that bludger chase after me you better clear off before my bones come back dobby or i might strangle you i dont suppose you could tell me why youre trying to kill me why do you wear that thing dobby repeat itself you mean this has happened before stop it stop it dobby tell me dobby when did this happen before whos doing it now no dobby tell me who is it thank you sir you wish rictusempra im a what i know i accidentally set a python on my cousin dudley at the zoo once once but so what i bet loads of people here can do it whats bad if i hadnt told that snake not to attack justin you were there you heard me i spoke a different language but i didnt realize how can i speak a language without knowing i can but im not i cant be ill see you back in the common room no mr filch you dont understand professor i swear i didnt professor dumbledore iii was just wondering if you put me in the right house youre wrong professor your birdthere was nothing i could do he just caught fire you dont think it was me professor no sir nothing crabbe and goyle ron maybe i should do it wingardium leviosa come on lets get them ron we still sound like ourselves you need to sound more like crabbe excellent hermione are you okay come on i think the slytherin common rooms this way im ah um reading youre wrong harry potter but then you must have some idea whos behind it all its his stomachache calm down hair hermione come out weve got loads to tell you hermione are you okay she should be out of hospital in a few days when she stops coughing up fur balls whats this looks like moaning myrtles flooded the bathroom why would i throw something at you but who threw it at you anyway tom marvolo riddle my name is harry potter do you know anything about the chamber of secrets can you tell me excuse me  could you tell me whats going on here are you tom riddle hello can you hear me dumbledore hagrid haagriiid wow it was hagrid  hagrid opened the chamber of secrets 50 years ago the monster had killed somebody ron what would any of us have done whats that youve got hagrid and they found it tom riddles diary is gone no weve got to talk to hagrid ron i cant believe its him but if he did set the monster loose last time hell know how to get inside the chamber of secrets thats a start i think its time to get my dads old cloak out again whats that for hagrid are you okay did you hear about hermione look we have to ask you something do you know whos opened the chamber of secrets look come on come on fang come on you heard what hagrid said follow the spiders shush come on dont panic were friends of hagrids and you youre aragog arent you hes in trouble up at the school there have been attacks they think its hagrid they think he opened the chamber of secrets like before then youre not the monster but if youre not the monster then what did kill that girl 50 years ago but have you seen it what well thank you well just go one but its not powerful enough for all of them lets go arania exumai go arania exumai dont mention it get us out of here now come on come on move faster come on go get us in the air come on pull we know one thing hagrid never opened the chamber of secrets he was innocent wish you were here hermione we need you now more than ever ron this is why hermione was in the library the day she was attacked come on of the many fearsome beasts that roam our land none is more deadly than the basilisk capable of living for hundreds of years instant death awaits any who meet this giant serpents eye spiders flee before it ron this is it the monster in the chamber of secrets is a basilisk thats why i can hear it speak its a snake because no one did look it in the eye not directly at least colin saw it through his camera justin justin must have seen the basilisk through nearly headless nick nick got the full blast of it but hes a ghost he couldnt die again and hermione had the mirror i bet you she was using it to look around corners in case it came along the water there was water on the floor that night she only saw the basilisks reflection spiders flee before it it all fits hermiones answered that too remember what aragog said about that girl 50 years ago she died in a bathroom what if she never left lockhart may be useless but hes going to try and get into the chamber at least we can tell him what we know professor we have some information for you are you going somewhere youre running away after all you did in your books you wrote them youre a fraud youve been taking credit for what other wizards have done dont even think about it to ask you how you died who was it myrtle just like that how this is it this is it ron i think this is the entrance to the chamber of secrets yes there is you first all right lets go thanks myrtle now remember any sign of movement close your eyes straightaway this way its a snake skin ron ron are you okay you wait here and try and shift some of this rock so we can get back through ill go on and find ginny ginny ginny please dont be dead wake up wake up please wake up tom tom riddle what do you mean she wont wake shes not are you a ghost shes cold as ice ginny please dont be dead wake up youve got to help me tom theres a basilisk give me my wand tom weve got to go weve got to save her no she couldnt she wouldnt but why and why did you want to meet me hagrids my friend and you framed him didnt you ill bet dumbledore saw right through you well you havent finished it this time in a few hours the mandrake draught will be ready and everyone who was petrified will be all right again why do you care how i escaped voldemort was after your time you youre the heir of slytherin youre voldemort albus dumbledore is the greatest sorcerer in the world hell never be gone  not as long as those who remain are loyal to him fawkes ginny ginny dont worry ginny you need to get yourself out follow the chamber and youll find ron you were brilliant fawkes i just wasnt quick enough of course phoenix tears have healing powers thanks its all right ginny its over its just a memory its just you see sir i couldnt help but notice certain things certain certain similarities between tom riddle and me voldemort transferred some of his powers to me so the sorting hat was right i should be in slytherin because i asked it to godric gryffindor dobby so this is your master the family you serve is the malfoys dont worry i will be sir i wonder if i could have that mr malfoy mr malfoy i have something of yours i think you do sir i think you slipped the diary into ginny weasleys cauldron that day at diagon alley open it just promise me something never try to save my life again we had loads of help from you we couldnt have done it without you theres no hogwarts without you hagrid lumos maxima lumos maxima lumos maxima lumos maxima uncle vernon i need you to sign this form nothing school stuff i will if she does yes okay oh yeah yeah ive been beaten loads of times thats a lie my dad wasnt a drunk shut up shut up no she deserved what she got keep away from me yeah try me i dont care anywhere is better than here i fell over i didnt do it on purpose nothing i didnt he leaky cauldron thats in london but the muggles cant they see us who is that that man how did he escape yeah him ive heard of hedwig no thank you minister i dont understand i broke the law underage wizards cant use magic at home the state of things sir sirius black you mean but whats he got to do with me hedwig egypt whats it like mrs weasley good to see you too yes its all upstairs everything thank you mr weasley yeah sure yeah it should be great has this anything to do with sirius black sir only that hes escaped from azkaban voldemort sorry and kill me mr weasley why would i go looking for someone who wants to kill me i didnt mean to blow her up i justi lost control i was lucky not to be arrested actually do you think hes really asleep i gotta tell you something yeah thanks ron i dont know maybe weve broken down thank you what was that thing that came what happened to me and did either of you two you know pass out but someone was screaming a woman how did he find out fortuna major fortuna major thank you still doing that after three years she cant even sing hey man shut up malfoy what hey hey hey brilliant professor at least hagrid didnt get fired i thought if you signed it then i could forget about it guys see you later professor can i ask you something i did think of voldemort at first but then i remembered that night on the train and the dementor before i fainted i heard something a woman screaming i think it was my mother the night she was murdered haunted building in britain i know whats going on excuse me sir wheres professor lupin its quidditch tomorrow probably a right sight better than he normally does oh brilliant what happened really i meant the match who won no professor why do the dementors affect me so i mean more than everyone else im scared professor i need to know how to fight them you could teach me you made the one on the train go away but you made it go away guys let me go im trying to get to hogsmeade let me go come on guys dont what are you doing whats this rubbish messrs moony wormtail padfoot and prongs are proud to present the marauders map hang on this is hogwarts and that… no is that really so you mean this map shows everyone brilliant where did you get it he was their friend and he betrayed them he was their friend i hope he finds me because when he does im gonna be ready when he does im gonna kill him im sure yes expecto patronum shall we wand at the ready expecto patronum expecto expectoexpect thats one nasty dementor the first time i rode a broom theres another its not happy exactly well it is its the happiest ive ever felt but its complicated just do it expecto patronum expecto patronum i think ive had enough for today i was thinking of him and mum seeing their faces they were talking to me just talking thats the memory i chose i dont even know if its real but its the best i have ripped to pieces what are you talking about tell those spiders sorry mischief managed nox i was sleepwalking my dad didnt strut and nor do i if you dont mind i would appreciate it if you could lower your wand spare bit of parchment messrs moony wormtail padfoot and prongs offer their compliments to professor snape and and request he keep his large nose out of other peoples business no sir yes sir professor just so you know i dont think that map always works earlier it showed someone in the castle someone i know to be dead peter pettigrew its just what i saw good night professor hang on we better take this back fine see you later professor trelawney sorry no nothing why dont we just set him free hagrid hagrid itll be fine itll be okay what oh no ron wait thats not good ron run ron ron wait ron ron ron come on move dont worry i have a hunch i just hope im wrong come on ron the dog where is it then itll be you i know why you betrayed my parents youre the reason theyre dead who was it then expelliarmus tell me about peter no pettigrews dead you killed him the map was lying then all they could find of pettigrew was his show me give it to him ron no i know what he is but well take him to the castle get off i said wed take you to the castle after that the dementors can have you okay no dont worry okay its fine ill stay you okay i didnt think my dad would have wanted his best friends to become killers besides dead the truth dies with him alive youre free i know what come and live with you expelliarmus come on sirius sirius no sirius expecto patronum i saw my dad he sent the dementors away i saw him across the lake theyre gonna kill him its true sir sirius is innocent what just happened wheres ron i dont know going to hagrids hermione hermione hermione wait hermione will you please tell me what it is were doing thats us this is not normal you mean weve gone back in time good punch come on we should be at hagrids look buckbeaks still alive here they come id better hurry thats pettigrew hermione thats the he betrayed my parents you dont expect me to sit here are you mad that hurt what get away get off okay buckbeak come quickly  come with us now come on buckbeak okay quickly hurry up okay hurry up now buckbeak okay this way this way this way now now what how and now we wait yeah hermione before down by the lake when i was with sirius i did see someone that someone made the dementors go away it was my dad it was my dad conjured the patronus dead i know im just telling you what i saw you see sirius talking to me there hes asking me to come live with him when we free him ill never have to go back to the dursleys itll just be me and him we could live in the country someplace you can see the sky hell like that after all those years in azkaban lets go what are you doing thanks great now hes coming for us poor professor lupins having a really tough night sirius come on dont worry my dad will come hell conjure the patronus any minute now right there youll see dont worry he will he will come sirius expecto patronum you were right hermione it wasnt my dad i saw earlier it was me i saw myself conjuring the patronus before i knew i could do it this time because well i had already done it does that make sense i want to go with you but youre innocent my mothers eyes hes free we did it i dont know honestly ron how can somebody be in two places at once youve been sacked resigned why but dumbledore none of it made any difference pettigrew escaped what are you talking about for me but who sent it lumos i solemnly swear that i am up to no good mischief managed nox",5146,4.957198443579767,52.923861852433284
snake,thanks,1,1.0,100.0
someone,snake,1,1.0,100.0
