Character,Tokens,Size_of_vocab,Avg_length,Prop_stop_word
barkeep tom,ah hagrid the usual i presume bless my soul its harry potter,12,4.0,66.66666666666667
man,welcome back mr potter welcome back sorry fire youre on fire ahhhhhhhhhhhhhhhh ladies and gentlemen mr gilderoy lockhart last call for hogsmeade come on now,25,3.125,80.0
witch,doris crockford mr potter i cant believe im meeting you at last not lost are you my dear come with us  well help you find your way back now how much do you want,34,5.666666666666667,58.8235294117647
quirrell,harry potter cant tell you how pleased i am to meet you fearfully fascinating subject not that you need it eh potter oh yes of course troll in the dungeon  ttroolll in the dungeon  thought you ought to know  perhaps you ought to go mmight wake uphehahh hehe severusii thought  wwhat do you mmean yes he does seem the type doesnt he  next to him who would suspect pppoor sstuttering professor quirrell no dear boy i tried to kill you  and trust me if snapes cloak hadnt caught fire and broken my eye contact i would have succeeded  even with snape muttering his little countercurse i knew you were a danger right from the off  especially after halloween very good potter yes  snape unfortunately wasnt fooled  while everyone else was running to the dungeon he went to the 3rd floor to head me off  he of course never trusted me again he rarely left me alone  but he doesnt understand  im never alone never  nowwhat does this mirror do  i see what i desire  i see myself holding the stone  but how do i get it come here potter now tell me what do you see what is it what do you see tell the truth what do you see master you are not strong enough ahh ahh what is this magic ahhhhhhhhhh,223,6.194444444444445,53.36322869955157
boy,its a worldclass racing broom look at it the new nimbus 2000 its the fastest model yet ravenclaw follow me this way nice going harry that was wicked harry stay together ravenclaws follow me with dementors at every entrance delicious,40,4.0,65.0
goblin,and does mr harry potter have his key very well,10,5.0,50.0
griphook,vault 687 lamp please key please vault 713 stand back,10,2.0,100.0
ollivander,i wondered when id be seeing you mr potter it seems only yesterday that your mother and father were in here buying their first wands here we are give it a wave apparently not perhaps… this no no definitely not no matter i wonder curious very curious i remember every wand ive ever sold mr potter it so happens that the phoenix whose tail feather resides in your wand gave another feather just one other it is curious that you should be destined for this wand when its brother gave you that scar  we do not speak his name the wand chooses the wizard mr potter its not always clear why but i think it is clear that we can expect great things from you after all hewhomustnotbenamed did great things terrible yes but great,135,6.75,48.888888888888886
trainmaster,right on your left madam 9 34 think youre being funny do ya what do you two think youre doing,20,6.666666666666667,60.0
mrs. weasley,its the same every year packed with muggles of course  come on platform 9 34 this way all right percy you first fred you next oh im sorry george how to get onto the platform not to worry dear its rons first time to hogwarts as well all youve got do is walk straight at the wall between platforms 9 and 10 best do it at a bit of a run if youre nervous where have you been  harry how wonderful to see you dear  beds empty no note car gone you could have died you could have been seen  of course i don’t blame you harry dear well you’d best hope that i don’t put bars on your window ronald weasley   come on harry time for a spot of breakfast here we are harry  now tuck in that’s it there we go yes dear it was on the cat morning arthur this morning your sons flew that enchanted car of yours to surrey and back last night arthur well that’ll be errol with the post  oh fetch it will you percy please oh no we’ll manage  there’s only one place we’re going to get all of this  diagon alley right here we are harry you go first dear you go first ron so that harry can see how its done yes in you go thats it you see its quite easy dear dont be afraid come on come on in you go thats it mind your head thats right now take your floo powder thats it very good now dont forget to speak very very clearly what did he say dear i thought he did harry thank goodness wed hoped youd only gone one grate too far ohh here he is harry now you give me those and ill get them signed all of you wait outside thats it ron the train will be leaving any moment oh dear the trainll be leaving any moment  okay come on ginny well get you a seat hurry ronald weasley  how dare you steal that car i am absolutely disgusted  your fathers now facing an inquiry at work and its entirely your fault  if you put another toe out of line well bring you straight home and ginny dear congratulations on making gryffindor your father and i are so proud harry good to see you dear got everything yes all your books all of your clothes good boy quick quick ron ron oh for goodness sake dont lose him,433,5.56,56.594724220623505
george,hes not fred i am our job is to make sure that you dont get bloodied up too bad  cant make any promises of course  rough game quidditch but theyll turn up in a month or two do you like yours ron ron go go go go right yeah mum would never know not flashing that clipping again no not a soul the day maid cook lets walk you off a tower and see what you look like you gave us a right good scare but not clever enough well show you a quicker way come and join the big boys whats this rubbish he says its a wrench giving it to you i solemnly swear that i am up to no good we owe them so much in his study does that a lot where they are every minute there are seven secret passageways out of the castle wed recommend this one leads straight you to honeydukes oh harry and dont forget when youre done just give it a tap and say its a firebolt,176,5.5,53.40909090909091
fred,honestly woman you call yourself our mother im only joking i am fred hey well done harry  woods just told us brutal  but no ones died in years  someone will vanish occasionally   come on right come on okay come on shh  shh ok come on shh come on this lot won’t come cheap mum  the spell books alone are very expensive not to mention theyre dead scared that harry will petrify them if they fly anywhere near him not unless you count tom night maid the bloke who fixed the toilet peaky what do you expect he fell over 100 feet clever harry weve got a better way well get you there if you pipe down bless him now harry its the secret to our success but weve decided your needs are greater than ours george if you will dumbledore pacing everyone what theyre doing every day from filchs office first year the oneeyed witch passageway hurry filch is heading this way its the fastest broom in the world,171,4.333333333333333,59.76331360946745
ginny,good luck mum mummy have you seen my jumper leave him alone harry it was me but i swear i didnt mean to riddle made me and harry youre hurt the fat lady shes gone,35,4.375,60.0
ron,"excuse me do you mind everywhere else is full im ron by the way ron weasley so its true i mean do you really have the the scar wicked no thanks im all set they mean every flavor theres chocolate and peppermint and theres also spinach liver and tripe george sweared he got a bogeyflavoured one once its just a spell besides its the cards you want each packs got a famous witch or wizard ive got about 500 myself watch it oh thats rotten luck theyve only got one good jump in them to begin with i got about six of him well you cant expect him to hang around all day can you this is scabbers by the way pathetic isnt he fred gave me a spell as to turn him yellow want to see no sunshine daisies butter mellow turn this stupid fat rat yellow im ron weasley wicked mental that one im telling you there isnt a witch or wizard who went bad who wasnt in slytherin harry what is it i know you youre nearly headless nick look at that one made it can you imagine the look on old mcgonagalls face if we were late that was bloody brilliant turn it into rum  actually managed a weak tea yesterday before mails here up up shut up harry seeker  but first years never make their house teams  you must be the youngest quidditch player in fred and george are on the team too  beaters oh go on harry  quidditch is great  best game there is  and youll be great too whoa  harry you never told me your father was a seeker too im telling you its spooky  she knows more about you than you do ahh before the staircase moves again  does anybody feel likewe shouldnt be here its filchs cat thats it were done for alohomora probably thinks this doors locked what do they think theyre doing  keeping a thing like that locked up in a school i wasnt looking at its feet  i was a bit preoccupied with its heads  or maybe you didnt notice there were three she needs to sort out her priorities wingardrium leviosar  you do it then if youre so clever  go on go on its leviosa not leviosar  honestly shes a nightmare  no wonder she hasnt got any friends not by itself  trolls are really stupid  probably people playing jokes what i think the trolls left the dungeon hey pea brain  what wingardium leviosa  cool mind you we did save her life what are friends for take a bit of toast mate go on lets open it thats not just a broomstick harry  its a nimbus 2000 jinxing the broom  what do we do come on hermione go fluffy queen to e5 thats wizards chess  i see youve packed change of plans  my parents decided to go to romania to visit my brother charlie  hes studying dragons there weve looked a hundred times i think weve had a bad influence on her harry wake up  come on harry wake up happy christmas harry oh mum made it  looks like youve got one too yeah there they are  what is it well lets see then  put it on whoa i know what that is  thats an invisibility cloak theyre really rare  i wonder who gave it to you why i only see us thats me only im head boyand  im holding the quidditch cup  and bloody hell im quidditch captain too  i look good  harry do you think this mirror shows the future ill be right back wanna play chess wanna go and visit hagrid harry i know what youre thinking but dont theres something not right about that mirror im ready ask me any question i forgot copy off you thats insulting  its as if they dont trust us dumbledore again leglocker curse you have got to start standing up to people neville dumbledore is particularly famous for his defeat of the dark wizard grindelwald in 1945 for the discovery of the twelve uses of dragon bloodand his work on alchemy with his partner nicholas flamel this is light immortal  i know what it means  i know what that is  but hagrid how did you get one thats not just a dragon  thats a norwegian ridgeback  my brother charlie works with these in romania its crazy  and worse malfoy knows its bad okay but if he comes back you dont think hell try to kill you do you  and to think ive been worrying about my potions final speak for yourself  all right there harry perhaps you should see the nurse trevor shh go you shouldnt be here youre a little scary sometimesyou know that  brilliant but scary its for your own good you know sorry wait a minutehes  uh its got horrible breath what ew yuck ugh  ahh whoa  lucky this plantthing is here really kill us faster  oh now i can relax now what are we gonna do ahh harry harry help help help me help ahhh yeah whew lucky we didnt panic alohomora  well it was worth a try were looking for a big old fashioned one  probably rusty like the handle oh go on harry  if snape can catch it on that old broomstick you can  youre the youngest seeker in a century this complicates things a bit hurry up this is no graveyard  its a chessboard  its obvious isnt it  weve got to play our way across the room  all right harry you take the empty bishops square  hermione youll be the queens side castle  as for me ill be a knight well white moves first and thenwe play  you there d5  yes hermione i think this is going to be exactly like wizards chess castle to e4   pawn to c3 you understand right harry  once i make my move the queen will take methen youll be free to check the king do you want to stop snape from getting that stone or not harry its you that has to go on i know it  not me not hermione you  knightto h3 check ahhhh all right you hi harry rescuing you of course  now come on get your trunk you’d better stand back let’s go come on come on harry hurry up i’ve got you harry drive by the way harry happy birthday do you think it’d be all right if we had some of this it’s not much but it’s home they were starving him mum  there were bars on his window ginny she’s been talking about you all summer  a bit annoying really dad works in the ministry of magic in the misuse of muggle artifacts office  dad loves muggles thinks they’re fascinating he’s always doing that but harrys never traveled by floo powder before mum diagon alley mum fancies him i dont know the gateway has sealed itself for some reason harry if we cant get through maybe mum and dad cant get back the car aaa right oh no the invisibility booster must be faulty okay we cant be far behind we must be getting close haaaarryyy hold oonnn take my hand hold on yeah welcome home its not working stop stop stop my wand look at my wand whats happening scabbers youre okay the caaaar dads gonna kill me honestly professor snape i think it did more damage to us well go and get our stuff then youre going to expel us arent you say it im doomed bloody birds a menace what do we do now i smell trouble those are nimbus 2001 s how did you get those youll pay for that one malfoy eat slugs its disgusting hear what kill i dont like spiders whats that are you mad vera verto three guesses who do you think its true  do you think there really is a chamber of secrets lets think  who do we know who thinks all muggleborns are scum of course you heard him youll be next mudbloods crabbe and goyle must know maybe we could trick them into telling you mean if harry and i drink that stuff well turn into crabbe and goyle wicked malfoy will tell us anything ill stop it of course dont you see lucius malfoy must have opened it when he was at school here now hes taught draco how to do it enlighten me why are we brewing this potion in broad daylight in the middle of the girls lavatory dont you think well get caught why who whos moaning myrtle who cares youre a parselmouth why didnt you tell us thats what you said to it i heard you speaking parseltongue snake language exactly now the whole schools gonna think youre his greatgreatgreat grandson how whose hair are you ripping out then yeah right how thick could you get essence of crabbe i think im gonna be sick harry bloody hell bloody hell but wheres hermione what are you doing d i mean what are you doing down here stomachache scar that was close look at your tail have you spoken to hermione yuck but it cant hurt if someone throws something at you i mean itll just go right through you we dont even know this tom riddle he sounds like a dirty rotten snitch that would be a cheerful visit hello hagrid tell us have you been setting anything mad and hairy loose in the castle lately whoever it was they must have been looking for something hermione but you heard mcgonagall were not allowed to leave the tower except for class thats dads boss cornelius fudge minister of magic hagrids right with dumbledore gone therell be an attack a day what theyre heading to the dark forest why spiders why couldnt it be follow the butterflies harry i dont like this harry i dont like this at all can we go back now harry harry can we panic now know any spells wheres hermione when you need her glad were out of there thanks for that the flying gears jammed im trying follow the spiders follow the spiders if hagrid ever gets out of azkaban ill kill him i mean what was the point of sending us in there what have we found out whats that but if it kills by looking people in the eye why is it no ones dead and mrs norris im pretty sure she didnt havea camera or a mirror harry hows a basilisk been getting around a dirty great snake someone would have seen it pipes its using the plumbing moaning myrtle her skeleton will lie in the chamber forever ginny what about my sister youre the defense against the dark arts teacher  you cant go now is there anything you can do say something  harry say something in parseltongue better you than us go on whats this bloody hell whatever shed this must be 60 feet long or more heart of a lion this one harry harry im fine ron weasley lockharts memory charm backfired he hasnt got a clue who he is no what do i do now okay thanks sir welcome back hermione im warning you hermione keep that beast away from scabbers or ill turn it into a tea cozy a cat is that what they told you looks like a pig with hair harry brilliant loads of old stuff like mummies tombs even scabbers enjoyed himself along with the dung beetle i havent shown anyone brilliant i still think it was brilliant who do you think that is do you know everything how is it she knows everything oh let me get this straight sirius black escaped from azkaban to come after you sure except no ones ever broken out of azkaban before and hes a murderous raving lunatic whats going on theres something moving out there i think someones coming aboard bloody hell whats happening well you sort of went rigid we thought maybe you were having a fit or something no i felt weird though like id never be cheerful again shove off malfoy green thats a monkey what is that do not give him one again hey neville try an elephant i will oh dont try one of them look at him his face where did you come from sure yeah harrys got sort of a wonky cross thats trials and suffering and that there could be the sun and thats happiness so youre gonna suffer but youre gonna be happy about it you dont think that grim things got anything to do with sirius black ancient runes exactly how many classes are you taking hang on thats not possible ancient runes is in the same time as divination you have to be in two classes at once youre supposed to stroke it hagrid exactly what is that listen to the idiot hes really laying it on thick isnt he who when did she get here riddikulus honeydukes sweetshop is brilliant but nothing beats zonkos joke shop we never got to go to the shrieking shack you heard its the most probably neville forgot the password again oh youre there serves her right she was a terrible singer werewolves when did she come in did you see her come in hes got a point you know he looks a bit peaky doesnt he well you fell off your broom theres something else you should know too when you fell your broom sort of blew into the whomping willow andwell twice actually im fine here shut your mouth malfoy whats up malfoy lost your skis bloody hell harry that was not funny those weasels never told me about any marauders map sure along with his invisibility cloak thats not true thick heads merry christmas gorgeous unless youve been ripped to pieces i havent lost anything your cat killed him harry youve seen the way that bloodthirsty beast of hers is always lurking about and scabbers is gone your cat killed him did theyre not sacking you spiders theres theres spiders spiders they want me to tapdance i dont wanna tapdance right yeah tell them ill tell them shes gone mental hermione has i mean not that she wasnt always mental but now its in the open for everyone to see im not going back see you it just got worse hermione no hes not worth it not good brilliant scabbers youre alive right next time i see crookshanks ill let him know lets go he bit me scabbers scabbers come back scabbers you bit me harry hermione run its the grim ah harry harryhelp its a trap hes the dog hes an animagus harry what did you just do me hes mental scabbers has been in my family for so what what are you trying to do to him scabbers leave him alone get off him what are you doing a bit a bit you almost tore my leg off you better go im fine go so painful they might chop it its too late its ruined itll have to be chopped off hermione bad idea bad idea nice doggy nice doggy its scabbers who did it hes my rat sir hes not really a rat he was a rat he was my brother percys rat but then they gave him an owl what the bloody hell was that all about hermione no hes not worth it not good brilliant scabbers youre alive lets go how did you get there i was talking to you there and now youre there stand back i said or ill take it upstairs if you dont settle quiet let the man through i didnt mean to open it harry it was badly wrapped they made me do it no one knows",2655,4.902985074626866,56.3165905631659
woman,anything off the trolley dears,5,5.0,60.0
