Character,Tokens,Size_of_vocab,Avg_length,Prop_stop_word
dumbledore,i shouldve known that you would be here professor mcgonagall im afraid so professor the good and the bad hagrid is bringing him ah professor i would trust hagrid with my life no problems i trust hagrid albus do you really think its safe leaving him with these people the only family he has exactly hes far better off growing up away from all of that until hes ready there there hagrid its not really goodbye after all good luckharry potter i have a few startofterm notices i wish to announce the first years please note that the dark forest is strictly forbidden to all students also our caretaker mr filch has asked me to remind you that the thirdfloor corridor on the right hand side is out of bounds to everyone who does not wish to die a most painful death thank you let the feast begin sillllleeennnnceeeee  everyone will please not panic  now prefects will lead their houses back to the dormitories  teachers will follow me to the dungeons back again harry i see that you like so many before you have discovered the delights of the mirror of erised  i trust by now you realize what it does  let me give you a clue  the happiest man on earth would look into the mirror and see only himself exactly as he is yesand no  it shows us nothing more or less than the deepest most desperate desires of our hearts  now you who have never known your family you see them standing beside you  but remember this harry  this mirror gives us neither knowledge or truth  men have wasted away in front of it even gone mad  that is why tomorrow it will be moved to a new home and i must ask you not to go looking for it again it does not do to dwell on dreams harry and forget to live good afternoon harry  ah tokens from your admirers what happened down in the dungeons between you and professor quirrell is a complete secret so naturally the whole school knows  ah i see your friend ronald has saved you the trouble of opening your chocolate frogs fine theyre both just fine relax dear boy the stone has been destroyed  my friend nicholas and i had a little chat and agreed it was best all around he has enough elixir to set his affairs in order  but yes he will die ah you see only a person who wanted to find the stone find it but not use it would be able to get it  that is one of my more brilliant ideas  and between you and me thats saying something ah im afraid there are ways in which he can return  harry do you know why professor quirrell couldnt bear to have you touch him it was because of your mother  she sacrificed herself for you and that kind of act leaves a mark  no no this kind of mark cannot be seen it lives in your very skin love harry love  ah bertie botts every flavour beans  i was most unfortunate in my youth to come across a vomit flavoured one and since then i have lost my liking for them  but i think i could be safe with a nice toffee mm alas earwax another year gone  and now as i understand it the house cup needs awarding and the points stand thus  in fourth place gryffindor with 312 points  third place hufflepuff with 352 points  in second place ravenclaw with 426 points and in first place with 472 points slytherin house yes yes well done slytherin well done slytherin  however recent events must be taken into account  and i have a few last minute points to award  to miss hermione granger for the use of cool intellect when others were in great peril 50 points  second to mr ronald weasley for the best played game of chess that hogwarts has seen these many years50 points  and third to mr harry potter for pure nerve and outstanding courage i award gryffindor house 60 points  and finally it takes a great deal of bravery to stand up to your enemies but a great deal more to stand up to your friends  i award 10 points to neville longbottom assuming that my calculations are correct i believe that a change of direction is in order  gryffindor wins the house cup they are not i am well aware of our bylaws having written quite a few of them myself however as head of gryffindor house it is for professor mcgonagall to determine the appropriate action argus argus i everyone will proceed to their dormitories immediately everyone except you three shes not dead argus she has been petrified but how she has been petrified i cannot say innocent until proven guilty severus we will be able to cure her argus as i understand it madam sprout has a very healthy growth of mandrake when matured a potion will be made which will revive mrs norris and in the meantime i strongly recommend caution to all theres been another attack it means that our students are in great danger the truth tell them hogwarts is no longer safe it is as we feared minerva the chamber of secrets has indeed been opened again harry and about time too hes been looking dreadful for days pity you had to see him on a burning day fawkes is a phoenix harry they burst into flame when it is time for them to die and then they are reborn from the ashes fascinating creatures phoenixes they can carry immensely heavy loads their tears have healing powers hagriiid relax i do not believe that harry attacked anyone yes no harry i do not think it was you but i must ask you is there something you wish to tell me very well then off you go riddle come it is not wise to be wandering around this late hour tom im afraid they are tom they are true i understand tom but im afraid headmaster dippet may have no choice is there something you wish to tell me very well then off you go good evening hagrid i wonder could we i want it understood cornelius that hagrid has my full confidence well what exactly is it that you want with me calm yourself hagrid if the governors desire my removal i will of course step aside however you will find that help will always be given at hogwarts to those who ask for it you both realize of course that in the past few hours you have broken perhaps a dozen school rules there is sufficient evidence to have you both expelled therefore it is only fitting that you both receive special awards for services to the school now mr weasley if you would have an owl deliver these release papers to azkaban i believe we want our gamekeeper back harry first i want to thank you harry you must have shown me real loyalty down in the chamber nothing but that could have called fawkes to you and second i sense that something is troubling you am i right harry i see well you can speak parseltongue harry why because lord voldemort can speak parseltongue if im not mistaken harry he transferred some of his powers to you the night he gave you that scar not intentionally but yes its true you possess many of the qualities that voldemort himself prizes determination resourcefulness and if i may say so a certain disregard for the rules why then did the sorting hat place you in gryffindor exactly harry exactly which makes you different from voldemort it is not our abilities that show what we truly are it is our choices if you want proof why you belong in gryffindor then i suggest you look more closely at this be careful it would take a true gryffindor to pull that out of the hat when the governors learned that arthur weasleys daughter was taken into the chamber they saw fit to summon me back curiously lucius several of them were under the impression that you would curse their family if they did not agree to suspend me in the first place beg your pardon yes voldemort only this time he chose to act through somebody else by means of this fortunately our young mr potter discovered it one hopes that no more of lord voldemorts old schoolthings should find their way into innocent hands the consequences for the one responsible would be severe before we begin the feast let us have a round of applause for professor sprout madam pomfrey whose mandrake juice has been so successfully administered to all who had been petrified also in light of the recent events as a school treat all exams have been canceled welcome welcome to another year at hogwarts now id like to say a few words before we all become too befuddled by our excellent feast first im pleased to welcome professor rj lupin whos kindly consented to fill the post of defense against the dark arts teacher good luck professor our care of magical creatures teacher has decided to retire in order to spend more time with his remaining limbs fortunately im delighted to announce that his place will be taken by none other than our own rubeus hagrid finally on a more disquieting note at the request of the ministry of magic  hogwarts will until further notice play host to the dementors of azkaban until such a time as sirius black is captured the dementors will be stationed at every entrance to the grounds now whilst ive been assured that their presence will not disrupt our daytoday activities a word of caution dementors are vicious creatures theyll not distinguish between the one they hunt and the one who gets in their way therefore i must warn each and every one of you to give them no reason to harm you it is not in the nature of a dementor to be forgiving but you know happiness can be found even in the darkest of times if one only remembers to turn on the light mr filch round up the ghosts tell them to search every painting in the castle to find the fat lady keep moving dear lady who did this to you secure the castle mr filch the rest of you to the great hall thank you very good i didnt really expect him to linger quite remarkable yes many each as unlikely as the next not a single professor inside this castle would help sirius black enter it im quite convinced the castle is safe and im more than willing to send the students to their houses perhaps but for now let him sleep for in dreams we enter a world thats entirely our own let them swim in the deepest ocean or glide over the highest cloud aresto momentum no minister over this way thats ling you see over there on the slope ah hagrid good evening id like a cup of tea now now hagrid now come on all right itll be all right scabbers i do miss granger but the word of three 13yearold wizards will convince few others a childs voice however honest and true is meaningless to those who have forgotten how to listen mysterious thing time powerful and when meddled with dangerous sirius black is in the topmost cell of the dark tower you know the laws miss granger you must not be seen and you would do well i feel to return before this last chime if not the consequences are too ghastly to discuss if you succeed tonight more than one innocent life may be spared three turns should do it i think oh and by the way when in doubt i find retracing my steps to be a wise place to begin good luck minister i really think i should sign as well its such a very long name here we are minister follow me now look there look beyond the rocks professor dippet had that ling planted when he was headmaster and all the strawberries over there over there all right how extraordinary i dont think the ministers suggesting you had anything to do with this afterall how could you youve been with us all the time well search the skies if you must minister meanwhile id like a nice cup of tea or a large brandy oh executioner your services are no longer required thank you well did what good night,2106,8.803347280334728,50.2851711026616
mcgonagall,"good evening professor dumbledore are the rumors true albus and the boy do you think it wise to trust hagrid with something as important as this ive watched them all day theyre the worst sort of muggles imaginable they really are this boy will be famous there wont be a child in our world who doesnt know his name welcome to hogwarts now in a few moments youll pass through these doors and join your classmates but before you can take your seats you must be sorted into your houses they are gryffindor hufflepuff ravenclaw and slytherin now while youre here your house will be like your family your triumphs will earn you points any rulebreaking and you will lose points at the end of the year the house with the most points is awarded the house cup the sorting ceremony will begin momentarily were ready for you now follow me all right will you wait along here please now before we begin professor dumbledore would like to say a few words when i call your name you will come forth i shall place the sorting hat on your head and you will be sorted into your houses hermione granger draco malfoy susan bones ronald weasley harry potter your attention please thank you for that assessment mr weasley perhaps ltd be more useful if i were to transfigure mr potter and yourself into a pocketwatch that way one of you might be on time then perhaps a map i trust you dont need one to find your seats harry potter follow me you wait here professor quirrell excuse me could i borrow wood for a moment please potter this is oliver wood wood i have found you a seeker oh oh my goodness  eexplain yourselves both of you  ms granger be that as it mayit was an extremely foolish thing to do  i would have expected more rational behaviour on your part and i am very disappointed in you ms granger  5 points will be taken from gryffindor for your serious lack of judgment  as for you two gentlemen i just hope you realize how fortunate you are  not many first year students could take on a full grown mountain troll and live to tell the tale  5 pointswill be awarded to each of you  for sheer dumb luck  good evening nothing i repeat nothing gives a student the right to walk about the school at night  therefore as punishment for your actions 50 points will be taken each and to ensure it doesnt happen again all four of you will receive detention no you heard me correctly mr malfoy  you see as honorable as your intentions were you too were out of bed after hours  you will join your classmates in detention im afraid professor dumbledore is not here  he received an urgent owl from the ministry of magic and left immediately for london how do you know i dont know how you three found out about the stone but i can assure you it is perfectly wellprotected  now would you go back to your dormitories quietly  what are you talking about mr weasley not today mr weasley but i must impress on both of you the seriousness of what you have done i will be writing to your families tonight and you will both receive detention could i have your attentionplease right now today we will be transforming animals into water goblets like so one two three vera verto now its your turn who would like to go first ahh  mr weasley one two three vera verto that wand needs replacing mr weasley yes miss granger very well you all know of course that hogwarts was founded over a thousand years ago by the four greatest witches and wizards of the age godric gryffindor helga hufflepuff rowena ravenclaw salazar slytherin now three of the founders coexisted quite harmoniously one did not salazar slytherin wished to be more selective about the students admitted to hogwarts he believed magical learning should be kept within allmagic families in other words purebloods unable to sway the others he decided to leave the school now according to legend slytherin had built a hidden chamber in this castle known as the chamber of secrets though shortly before departing he sealed it until that time when his own true heir returned to the school the heir alone would be able to open the chamber and unleash the horror within and by so doing purge the school of all those who in slytherins view were unworthy to study magic well  naturally the school has been searched many times no such chamber has been found the chamber is said to be home to something that only the heir of slytherin can control it is said to be the home of a monster i think hes been petrified madam pomfrey look perhaps he managed to take a picture of his attacker what can this mean albus what should i tell the staff this is out of my hands potter professor dumbledore will be waiting for you sherbet lemon this match has been canceled silence wood you and your teammates will go to gryffindor tower now potter you and i will find mr weasley theres something the both of you have to see i warn you this could be a wee bit of a shock she was found near the library along with this does it mean anything to either of you could i have your attention please because of recent events these new rules will be put into effect immediately all students will return to their house common rooms by 600 every evening all students will be escorted to each lesson by a teacher no exceptions i should tell you this unless the culprit behind these attacks is caught it is likely the school will be closed all students are to return to their house dormitories at once all teachers to the secondfloor corridor immediately as you can see the heir of slytherin has left another message our worst fear has been realized a student has been taken by the monster into the chamber itself the students must be sent home im afraid this is the end of hogwarts thats settled  well leave you to deal with the monster gilderoy your skills after all are legend ginny weasley could i have your attention please remember these visits to hogsmeade village are a privilege should your behavior reflect poorly on the school that privilege shall not be extended again no permission form signed no visiting the village thats the rule potter i cant only a parent or a guardian can sign since i am neither it would be inappropriate im sorry potter thats my final word cornelius professor dumbledore doesnt want dementors around the place years ago when harry potters parents realized they were marked for death remember they hid few knew where they were one who did was sirius black and he told youknowwho little lump of a boy always trailing after black peter tried to warn the potters and might have had he not run into an old friend sirius black yes sirius black may not have put his hands to the potters but hes the reason theyre dead this sirius black was and remains to this day harry potters godfather little lump of a boy always trailing after sirius black",1234,8.118421052631579,51.13452188006483
