Character,Tokens,Size_of_vocab,Avg_length,Prop_stop_word
hermione,"has anyone seen a toad a boy named nevilles lost one oh are you doing magic lets see then are you sure thats a real spell well its not very good is it of course ive only tried a few simple ones myself but theyve all worked for me for example oculus reparo thats better isnt it holy cricket youre harry potter im hermione granger and you are pleasure you two better change into robes i expect well be arriving soon youve got dirt on your nose by the way did you know just there its not real the ceiling  its just bewitched to look like the night sky i read about it in hogwarts a history oh no okay relax nearly headless how can you be nearly headless ive read about those when the smoke turns red it means youve forgotten something up up up harry no way you heard what madam hooch said besides you dont even know how to fly what an idiot you wont make a fool of yourself  its in your blood the staircases change remember were not supposed to be here  this is the 3rd floor  its forbidden oh move over  alohomora get in standard book of spells chapter 7 filch is gone  it was locked  you dont use your eyes do you  didnt you see what it was standing on it was standing on a trap door  which means it wasnt there by accident  its guarding something thats right  now if you two dont mind im going to bed before either of you come up with another clever idea to get us killedor worse expelled stop stop stop youre going to take someones eye out  besides youre saying it wrong  its leviosa not leviosar wingardium leviosa help help ahhh help swish and flick is itdead its my fault professor mcgonagall  i went looking for the troll  id read about them and thought i could handle it  but i was wrong  if harry and ron hadnt come and found me id probably be dead rons right harry  youre gonna need your strength today blood  but why would anyone go near that dog so youre saying bit early for mail isnt it its snape  hes jinxing the broom leave it to me  lacarnum inflamarae whoohoo that thing has a name hogwarts teacher or not i know a curse when i see one  ive read all about them  you have to keep eye contact  and snape wasnt blinking i dont know thats totally barbaric see you havent good you can help harry then  hes going to go the library for information on nicholas flamel not in the restricted section happy christmas look at you playing with your cards pathetic weve got final exams coming up soon alright what are the 3 most crucial ingredients in a forgetfulness potion follow me i had you looking in the wrong section  how could i be so stupid  i checked this out a few weeks ago for a bit of light reading of course here it is  nicholas flamel is the only known maker of the philosophers stone honestly dont you two read  the philosophers stone is a legendary substance with astonishing powers  it will turn any metal into pure gold and produces the elixir of life which will make the drinker immortal it means youll never die the only stone currently in existence belongs to mr nicholas flamel the noted alchemist who last year celebrated his 665th birthday thats what fluffys guarding on the 3rd floor  thats whats under the trapdoor the philosophers stone of course there are other things defending the stone arent there spells and enchantments is thata dragon is that bad well thats good isnt it  hell be with his own kind harry you mean youknowwhos out there right now in the forest hang on a minute were forgetting one thing  whos the one wizard voldemort always feared  dumbledore  as long as dumbledores around youre safe  as long as dumbledores around you cant be touched   ive always heard hogwarts end of the year exams were frightful but i found that rather enjoyable its happened before  what is it  and with dumbledore gone uhwe were just now what do we do  neville im really really sorry about this  petrificus totalus sorry ow you stood on my foot alohomora the harp it stopped playing stop moving both of you  this is devils snare  you have to relax  if you dont it will only kill you faster just relax do what i say trust me  are you okay hes not relaxing is he weve got to do something uh i remember reading something in herbology  um devils snare devils scareits deadly funbut will sulk in the sun  thats it devils snare hates sunlight lumus solem what is that curious ive never seen birds like these whats this all about ugh whatre we going to do  there must be 1000 keys up there whats wrong harry i dont like this  i dont like this at all now what do we do what happens now ron you dont suppose this is going to be likereal wizards chess do you  what is it no ron you cant there must be another way youll be okay harry  youre a great wizard you really are me books and cleverness  there are more important things  friendship and bravery  and harry just be careful never better were tied with slytherin come on harry feels strange to be going home doesnt it harry hagrid its so good to see you what did you do to your glasses oculus reparo okay bye come on everyones been so worried fear of a name only increases fear of the thing itself mandrake or mandragora is used to return those who have been petrified to their original state its also quite dangerous  the mandrakes cry is fatal to anyone who hears it get off me immobulus at least no one on the gryffindor team had to buy their way in they got in on pure talent you okay ron say something he called me a mudblood it means dirty blood mudbloods a foul name for someone whos muggleborn someone with nonmagic parents someone like me its not a term one usually hears in civilized conversation harry voice what voice harry wait not so fast the chamber of secrets has been opened 
enemies of the heir beware enemies of the heir beware its written in blood thats why ron and i went looking for him professor wed just found him when he said its a bit strange isnt it you hear this voice a voice only you can hear and then mrs norris turns up petrified its just strange no harry even in the wizarding world hearing voices isnt a good sign professor i was wondering if you could tell us about the chamber of secrets muggleborns professor what exactly does legend tell us lies within the chamber yes couldnt you tell  mcgonagalls worried  all the teachers are the heir of slytherin has returned to hogwarts  the question is who is it if youre talking about malfoy i heard him but malfoy the heir of slytherin even they arent that thick but there might be another way mind you it would be difficult not to mention wed be breaking about 50 school rules and itll be dangerous very dangerous here it is the polyjuice potion properly brewed the polyjuice potion allows the drinker to transform himself temporarily into the physical form of another yes  exactly but its tricky  ive never seen a more complicated potion a month i know but its the only plan weve got no even with a proper wand its too risky you could hit harry lets go finite incantatem are you okay you will be able to wont you again you mean the chamber of secrets has been opened before maybe well have to wait for the polyjuice potion to know for sure no no one ever comes in here moaning myrtle moaning myrtle shes a little sensitive do you think hes all right you can talk to snakes no they cant its not a very common gift harry this is bad i dont know but it sounded like you were egging the snake on or something harry listen to me theres a reason the symbol of slytherin house is a serpent salazar slytherin was a parselmouth he could talk to snakes too he lived a thousand years ago for all we know you could be everythings set  we just need a bit of who youre changing into we also need to make sure that the real crabbe and goyle cant burst in on us while were interrogating malfoy ive got it all worked out i filled these with a simple sleeping draught simple but powerful now once theyre asleep hide them in the broomstick cupboard and pull out a few of their hairs and put on their uniforms ive already got mine millicent bulstrode slytherin i got this off her robes im going to go check on the polyjuice potion make sure that crabbe and goyle find these well have exactly one hour before we change back into ourselves add the hairs cheers me too ii dont think im going you go on without me just go youre wasting time go away do you remember me telling you that the polyjuice potion was only for human transformations it was cat hair i plucked off millicent bulstrodes robes look at my face it cant be hagrid it just cant be look hagrids our friend  why dont we just go and ask him about it it had to be a gryffindor nobody else knows our password unless it wasnt a student thanks sir nicholas its good to be back congratulations i cant believe you solved it thanks oh no its a cat ronald what do you expect its in his nature thats rich coming from the owner of that smelly old shoe brush crookshanks just ignore the mean little boy harry egyptians used to worship cats good morning mr weasley honestly ron its not funny harry was lucky not to be expelled come on everywhere else is full professor rj lupin its on his suitcase ronald seems to be why but theyll catch black wont they i mean everyones looking for him why are we stopping we cant be there yet ouch ron that was my foot harry harry are you all right no one was screaming harry of course thats why he knew to give you the chocolate harry just forget it thats awful what a load of rubbish me ive been here all this time oh honestly ron if you ask me divinations a woolly discipline now ancient runes thats a fascinating subject a fair few dont be silly how could anyone be in two classes at once broaden your minds use your inner eye to see the future i think theyre funny just ignore him tah tah tah dah isnt he beautiful say hello to buckbeak that was wicked harry hagrid he has to be taken to the hospital i hear dracos fathers furious we havent heard the end of this dufftown thats not far from here no one knows boggarts are shapeshifters they take the shape of whatever a person fears the most thats what makes them so its not funny ron sir we just learned about red caps and hinkypunks were not meant to start that for weeks please sir an animagus is a wizard who elects to turn into an animal a werewolf has no choice with each full moon he no longer remembers who he is hed kill his best friend furthermore the werewolf only responds to the call of its own kind go harry go harry how are you feeling no one blames you harry dementors arent supposed to be on the grounds dumbledores furious after he saved you he sent them off its meant to be the most haunted building in britain did i mention that do you want to move a bit closer to the shrieking shack hope you dont mean yourself harry he wont keep it hell turn it over to professor mcgonagall arent you look who it is madam rosmerta ron fancies her harry so rude ron look sorry sorry excuse me excuse me harry what happened beautiful day ronald has lost his rat rubbish well maybe you should learn to take better care of your pets did not didnt how did it go hagrid the hearing and then do you mind me trying the grim possibly i cant believe theyre going to kill buckbeak its just too horrible you you foul loathsome evil little cockroach that felt good well stay with you too i think you owe someone an apology i meant me i thought i just sawnever mind ron ron harry you do realize what tree this is ron ron duck harry oh im sorry where do you suppose this goes were in the shrieking shack arent we ron youre okay if you want to kill harry you have to kill us too no i trusted you and all this time youve been his friend hes a werewolf thats why hes been missing classes since professor snape set the essay you attacked a teacher you go ill stay that looks really painful im sure madam pomfrey will fix it in a heartbeat harry harry wait wait professor professor lupin harry what listen harry theyve captured sirius any minute the dementors are gonna perform the kiss no its worse much worse theyre going to suck out his soul headmaster youve got to stop them theyve got the wrong man the point is we know the truth please believe us sorry ron but seeing as you cant walk 0730 where were we at 730 come on and we cant be seen you you foul loathsomeevil little cockroach this is a timeturner harry mcgonagall gave it to me first term this is how ive been getting to my lessons all year yes dumbledore obviously wanted us to return to this moment clearly something happened he wants us to change thanks malfoys coming that felt good of course remember what dumbledore said if we succeed more than one innocent life could be spared lets go fudge has to see buckbeak before we steal him otherwise hell think hagrid set him free harry you cant yes and you must harry youre in hagrids hut now if you go bursting in youll think youve gone mad awful things happen to wizards who meddle with time harry we cant be seen fudge is coming and we arent leaving why arent we leaving sorry were coming out the back door go is that really what my hair looks like from the back i thought i just saw… never mind okay go harry go keep trying come on quickly come on come on buckbeak come and get the nice dead ferret come on its here come on beaky come on buckbeak come on buckbeak come on we save sirius no idea look its lupin and snapes coming and now we wait at least someones enjoying himself yeah with a patronus i heard snape telling dumbledore according to him only a really powerful wizard could have conjured it harry but your dads here we come thats great harry saving your life yeah i didnt think about that run that was so scary this is horrible harry listen to me no ones coming youre dying both of you harry no but i dont like flying bombarda we have to go whats he talking about harry this came with it how fast is it harry",2620,5.397938144329897,55.15660809778457
neville,trevor sorry that pictures moving the only problem is i cant remember what ive forgotten down down parvati patil said that she wouldnt come out of the girls bathroom  she said that shed been in there all afternooncrying how i can barely stand at all no thats all i need you to set my bloody kneecups on fire hey wait where are you going what about the countercurse neither should you  youre sneaking out again arent you no i wont let you  youll get gryffindor in trouble again  iill fight you go on ron  i ignored one from my gran once  it was horrible please get me down why is it always me harry i dont know who did it but youd better come come on harry its hermione i think so im okay okay yeah you dont think hed come to hogwarts do you professor snape professor snape yes i dont want it to turn into her either she carries a red handbag riddikulus hey harry wherever did you get it,172,4.777777777777778,51.16279069767442
malfoy,its true then what theyre saying on the train harry potter has come to hogwarts this is crabbe and goyle and im malfoy draco malfoy think my names funny do you ive no need to ask yours red hair and a handmedown robe you must be a weasley well soon find out that some wizarding families are better than others potter you dont want to go making friends with the wrong sort i can help you there up did you see his face maybe if the fat lump had given this a squeeze hed have remembered to fall on his fat arse no i think ill leave it somewhere for longbottom to find how about on the roof whats the matter potter bit beyond your reach is that so have it your way then excuse me professor  perhaps i heard you wrong  i thought you saidthe four of us the forest i thought that was a joke  we cant go in there  students arent allowed  and there arewerewolves okay then i get fang you wait till my father hears about this  this is servants stuff scared potter  did you hear that  come on fang  scared ahhhhhhhhh ahhh help nice one mate ,201,5.583333333333333,53.233830845771145
whispers,harry potter,2,2.0,100.0
sorting hat,ah right then hmm right okay gryffindor slytherin lets see i know hufflepuff another weasley i know just what to do with you gryffindor hmm difficult very difficult plenty of courage i see not a bad mind either theres talent oh yes and a thirst to prove yourself but where to put you not slytherin eh are you sure you could be great you know its all here in your head and slytherin will help you on the way to greatnesses no doubt about that no well if youre sure better begryffindor bee in your bonnet potter yes you were particularly difficult to place but i stand by what i said last year you would have done well in slytherin,120,5.217391304347826,52.5
seamus,im half and half my dads a muggle mums a witch bit of a nasty shock for him when he found out eye of rabbit harp string hum turn this water into rum eye of rabbit wingard levosa wingardly lev  ill do the countercurse i dont appreciate the insinuation longbottom besides if anyone cared to notice my eyebrows have completely grown back yeah we won no maam hes just fainted heads up everyone  weasleys gotten himself a howler cornish pixies fortuna major here listen she just wont let me in exactly hey man ron catch i think we have a winner oh no the grin whats the grin hes been sighted sirius black dementors he slipped past them once whos to say he wont do it again can i have a go harry after you of course,137,4.419354838709677,57.66423357664234
percy,oh thats professor snape head of slytherin house potions but everyone knows its the dark arts he fancies hes been after quirrells job for years hello sir nicholas have a nice summer gryffindors follow me please keep up thank you this is the most direct path to the dormitories oh and keep an eye on the staircases they like to change keep up please and follow me quickly now come on come on caput draconis follow me everyone keep up quickly come on gather around here welcome to the gryffindor common room boys dormitory is upstairs and down to your left girls the same on your right youll find that your belongings have already been brought up gryffindorskeep up please  and stay alert errol oh look it’s our hogwarts letters  and they’ve sent us harry’s as well hello sir nicolas excuse me i happen to be a school prefect you on the other hand have no business wandering the corridors at night what are your names again mind your attitude malfoy let me through please excuse me im head boy get back all of you no one is to enter this dormitory until its been searched keep calm everyone break into fours back to your common room be quiet make way the headmasters here you heard move mind where youre going slow down you listen im head boy come back here,237,5.25,58.00865800865801
sir nicholas,hello how are you welcome to gryffindor dismal once again my request to join the headless hunt has been denied i prefer sir nicholas if you dont mind like this have you heard  harry potters the new gryffindor seeker  i always knew hed do well hello percy miss clearwater thank you good evening thank you hello hermione welcome back,59,4.214285714285714,62.71186440677966
girl,look its the bloody baron oh look look whos that girl is he all right hufflepuff this way,18,3.6,61.111111111111114
man in paint,welcome to hogwarts,3,3.0,66.66666666666667
fat lady,password no no wait wait watch this amazing just with my voice yes all right go in eyes like the devil hes got and a soul as dark as his name its him headmaster the one they all talk about hes here somewhere in the castle sirius black,48,4.8,52.083333333333336
snape,there will be no foolish wandwaving or silly incantations in this class as such i dont expect many of you to appreciate the subtle science and exact art that is potionmaking however for those select few who possess the predisposition i can teach you how to bewitch the mind and ensnare the senses i can tell you how to bottle fame brew glory and even put a stopper in death then again maybe some of you have come to hogwarts in possession of abilities so formidable that you feel confident enough to not pay attention mr potter our new celebrity tell me what would i get if i added powdered root of asphodel to an infusion of wormwood you dont know well lets try again where mr potter would you look if i asked you to find me a bezoar and what is the difference between monkshood and wolfsbane pity clearly fame isnt everything is it mr potter silence put your hand down you silly girl for your information potter asphodel and wormwood make a sleeping potion so powerful it is known as the draught of the living dead a bezoar is a stone taken from the stomach of a goat and it will save you from most poisons as for monkshood and wolfsbane they are the same plant which also goes by the name of aconite well why arent you all copying this down and gryffindors note that five points will be taken from your house for your classmates cheek good luck today potter  then again now that youve proven yourself against a troll a little game of quidditch should be easy work for youeven if it is against slytherin what oh you dont want me as your enemy quirrell you know perfectly well what i mean  well have another chat soon when youve had time to decide where your loyalties lie  good afternoon  now what would three young gryffindors such as yourselves be doing inside on a day like this you want to be careful people will think youre up to something you were seen by no less than seven muggles do you have any idea how serious this is you have risked the exposure of our world not to mention the damage you inflicted on a whomping willow thats been on these grounds since before you were born silence i assure you that were you in slytherin and your fate rested with me  the both of you would be on the train home tonight as it is headmaster these boys have flouted the decree for the restriction of underage wizardry if i might headmaster perhaps potter and his friends were just in the wrong place at the wrong time however the circumstances are suspicious i for one dont recall seeing potter at dinner yes miss granger expelliarmus perhaps it would be prudent to first teach the students to block unfriendly spells professor weasleys wand causes devastation with the simplest spells well be sending potter to the hospital wing in a matchbox might i suggest someone from my own house malfoy perhaps dont move potter ill get rid of it for you vipera evanesca a girl has been snatched by the monster lockhart  your moment has come at last werent you saying just last night that youve known all along where the entrance to the chamber of secrets is ive done the dungeons no sign of black nor anywhere else in the castle remarkable feat dont you think to enter hogwarts castle on ones own completely undetected any theories on how he managed it you may recall prior to the start of term i expressed concerns about your appointment of professor what about potter should he be warned turn to page 394 thats not really your concern is it potter suffice it to say your professor finds himself incapable of teaching at the present time turn to page 394 quiet now which one of you can tell me the difference between an animagus and a werewolf no one how disappointing thank you mr malfoy thats the second time youve spoken out of turn miss granger are you incapable of restraining yourself or do you take pride in being an insufferable knowitall five points from gryffindor as an antidote to your ignorance and on my desk by monday morning two rolls of parchment on the werewolf with emphasis on recognizing it then i suggest you take extra care mr potter loss of limb will not excuse you page 394 the term werewolf is a contraction of the anglosaxon word were which means man and wolf werewolf manwolf there are several ways to become a werewolf they include being given the power of shapeshifting being bitten by a werewolf potter what are you doing wandering the corridors at night how extraordinarily like your father you are potter he too was exceedingly arrogant strutting about the castle turn out your pockets turn out your pockets whats this really open it reveal your secrets read it go on you insolent little well well lupin out for a little walk in the moonlight are we that remains to be seen i have now just confiscated a rather curious artifact take a look lupin supposed to be your area of expertise clearly its full of dark magic expelliarmus vengeance is sweet how i hoped id be the one to catch you i told dumbledore you were helping a friend into the castle heres the proof give me a reason i beg you you two quarrelling like an old married couple i could do it you know but why deny the dementors theyre so longing to see you do i detect a flicker of fear oh yes a dementors kiss one can only imagine what that must be like its said to be nearly unbearable to witness but ill do my best after you there you are potter come back here potter,987,8.15702479338843,49.949341438703144
dean,hey look nevilles got a remembrall ron is that your owl oh god you call that a monkey thats a boggart that is,23,4.6,56.52173913043478
